11:30:43.743831 IP 1.1.2.3.39447 > 5.6.7.8.http: Flags [S], seq 2298223251, win 5840, options [mss 1460,sackOK,TS val 311587 ecr 0,nop,wscale 6], length 0
11:30:43.744142 IP 5.6.7.8.http > 1.1.2.3.39447: Flags [S.], seq 2654633501, ack 2298223252, win 5792, options [mss 1460,sackOK,TS val 311527 ecr 311587,nop,wscale 6], length 0
11:30:43.744178 IP 1.1.2.3.39447 > 5.6.7.8.http: Flags [.], ack 1, win 92, options [nop,nop,TS val 311587 ecr 311527], length 0
11:30:43.744243 IP 1.1.2.3.39447 > 5.6.7.8.http: Flags [P.], seq 1:117, ack 1, win 92, options [nop,nop,TS val 311587 ecr 311527], length 116
11:30:43.744490 IP 5.6.7.8.http > 1.1.2.3.39447: Flags [.], ack 117, win 91, options [nop,nop,TS val 311527 ecr 311587], length 0
11:30:43.746985 IP 5.6.7.8.http > 1.1.2.3.39447: Flags [.], seq 1:1449, ack 117, win 91, options [nop,nop,TS val 311528 ecr 311587], length 1448
11:30:43.746996 IP 1.1.2.3.39447 > 5.6.7.8.http: Flags [.], ack 1449, win 137, options [nop,nop,TS val 311587 ecr 311528], length 0
11:30:43.747003 IP 5.6.7.8.http > 1.1.2.3.39447: Flags [P.], seq 1449:2124, ack 117, win 91, options [nop,nop,TS val 311528 ecr 311587], length 675
11:30:43.747010 IP 1.1.2.3.39447 > 5.6.7.8.http: Flags [.], ack 2124, win 182, options [nop,nop,TS val 311587 ecr 311528], length 0
11:30:43.747570 IP 1.1.2.3.39447 > 5.6.7.8.http: Flags [F.], seq 117, ack 2124, win 182, options [nop,nop,TS val 311588 ecr 311528], length 0
11:30:43.747836 IP 5.6.7.8.http > 1.1.2.3.39447: Flags [F.], seq 2124, ack 118, win 91, options [nop,nop,TS val 311528 ecr 311588], length 0
11:30:43.747861 IP 1.1.2.3.39447 > 5.6.7.8.http: Flags [.], ack 2125, win 182, options [nop,nop,TS val 311588 ecr 311528], length 0
11:30:45.280856 IP 1.1.2.3.39448 > 5.6.7.8.http: Flags [S], seq 2884580989, win 5840, options [mss 1460,sackOK,TS val 311971 ecr 0,nop,wscale 6], length 0
11:30:45.281105 IP 5.6.7.8.http > 1.1.2.3.39448: Flags [S.], seq 2657271482, ack 2884580990, win 5792, options [mss 1460,sackOK,TS val 311912 ecr 311971,nop,wscale 6], length 0
11:30:45.281139 IP 1.1.2.3.39448 > 5.6.7.8.http: Flags [.], ack 1, win 92, options [nop,nop,TS val 311971 ecr 311912], length 0
11:30:45.281192 IP 1.1.2.3.39448 > 5.6.7.8.http: Flags [P.], seq 1:117, ack 1, win 92, options [nop,nop,TS val 311971 ecr 311912], length 116
11:30:45.281404 IP 5.6.7.8.http > 1.1.2.3.39448: Flags [.], ack 117, win 91, options [nop,nop,TS val 311912 ecr 311971], length 0
11:30:45.284198 IP 5.6.7.8.http > 1.1.2.3.39448: Flags [.], seq 1:1449, ack 117, win 91, options [nop,nop,TS val 311912 ecr 311971], length 1448
11:30:45.284210 IP 1.1.2.3.39448 > 5.6.7.8.http: Flags [.], ack 1449, win 137, options [nop,nop,TS val 311972 ecr 311912], length 0
11:30:45.284218 IP 5.6.7.8.http > 1.1.2.3.39448: Flags [.], seq 1449:2897, ack 117, win 91, options [nop,nop,TS val 311912 ecr 311971], length 1448
11:30:45.284224 IP 1.1.2.3.39448 > 5.6.7.8.http: Flags [.], ack 2897, win 182, options [nop,nop,TS val 311972 ecr 311912], length 0
11:30:45.284229 IP 5.6.7.8.http > 1.1.2.3.39448: Flags [.], seq 2897:4345, ack 117, win 91, options [nop,nop,TS val 311912 ecr 311971], length 1448
11:30:45.284238 IP 1.1.2.3.39448 > 5.6.7.8.http: Flags [.], ack 4345, win 227, options [nop,nop,TS val 311972 ecr 311912], length 0
11:30:45.284448 IP 5.6.7.8.http > 1.1.2.3.39448: Flags [P.], seq 4345:4670, ack 117, win 91, options [nop,nop,TS val 311912 ecr 311972], length 325
11:30:45.284463 IP 1.1.2.3.39448 > 5.6.7.8.http: Flags [.], ack 4670, win 273, options [nop,nop,TS val 311972 ecr 311912], length 0
11:30:45.284887 IP 1.1.2.3.39448 > 5.6.7.8.http: Flags [F.], seq 117, ack 4670, win 273, options [nop,nop,TS val 311972 ecr 311912], length 0
11:30:45.285148 IP 5.6.7.8.http > 1.1.2.3.39448: Flags [F.], seq 4670, ack 118, win 91, options [nop,nop,TS val 311912 ecr 311972], length 0
11:30:45.285171 IP 1.1.2.3.39448 > 5.6.7.8.http: Flags [.], ack 4671, win 273, options [nop,nop,TS val 311972 ecr 311912], length 0
11:30:45.495952 IP 1.1.2.3.39449 > 5.6.7.8.http: Flags [S], seq 3468161822, win 5840, options [mss 1460,sackOK,TS val 312025 ecr 0,nop,wscale 6], length 0
11:30:45.496157 IP 5.6.7.8.http > 1.1.2.3.39449: Flags [S.], seq 3096060058, ack 3468161823, win 5792, options [mss 1460,sackOK,TS val 311965 ecr 312025,nop,wscale 6], length 0
11:30:45.496192 IP 1.1.2.3.39449 > 5.6.7.8.http: Flags [.], ack 1, win 92, options [nop,nop,TS val 312025 ecr 311965], length 0
11:30:45.496244 IP 1.1.2.3.39449 > 5.6.7.8.http: Flags [P.], seq 1:117, ack 1, win 92, options [nop,nop,TS val 312025 ecr 311965], length 116
11:30:45.496455 IP 5.6.7.8.http > 1.1.2.3.39449: Flags [.], ack 117, win 91, options [nop,nop,TS val 311965 ecr 312025], length 0
11:30:45.499399 IP 5.6.7.8.http > 1.1.2.3.39449: Flags [.], seq 1:1449, ack 117, win 91, options [nop,nop,TS val 311966 ecr 312025], length 1448
11:30:45.499410 IP 1.1.2.3.39449 > 5.6.7.8.http: Flags [.], ack 1449, win 137, options [nop,nop,TS val 312025 ecr 311966], length 0
11:30:45.499418 IP 5.6.7.8.http > 1.1.2.3.39449: Flags [.], seq 1449:2897, ack 117, win 91, options [nop,nop,TS val 311966 ecr 312025], length 1448
11:30:45.499429 IP 1.1.2.3.39449 > 5.6.7.8.http: Flags [.], ack 2897, win 182, options [nop,nop,TS val 312025 ecr 311966], length 0
11:30:45.499434 IP 5.6.7.8.http > 1.1.2.3.39449: Flags [.], seq 2897:4345, ack 117, win 91, options [nop,nop,TS val 311966 ecr 312025], length 1448
11:30:45.499447 IP 1.1.2.3.39449 > 5.6.7.8.http: Flags [.], ack 4345, win 227, options [nop,nop,TS val 312025 ecr 311966], length 0
11:30:45.499750 IP 5.6.7.8.http > 1.1.2.3.39449: Flags [.], seq 4345:5793, ack 117, win 91, options [nop,nop,TS val 311966 ecr 312025], length 1448
11:30:45.499764 IP 1.1.2.3.39449 > 5.6.7.8.http: Flags [.], ack 5793, win 273, options [nop,nop,TS val 312026 ecr 311966], length 0
11:30:45.499772 IP 5.6.7.8.http > 1.1.2.3.39449: Flags [P.], seq 5793:7241, ack 117, win 91, options [nop,nop,TS val 311966 ecr 312025], length 1448
11:30:45.499788 IP 1.1.2.3.39449 > 5.6.7.8.http: Flags [.], ack 7241, win 318, options [nop,nop,TS val 312026 ecr 311966], length 0
11:30:45.499793 IP 5.6.7.8.http > 1.1.2.3.39449: Flags [.], seq 7241:8689, ack 117, win 91, options [nop,nop,TS val 311966 ecr 312025], length 1448
11:30:45.499798 IP 5.6.7.8.http > 1.1.2.3.39449: Flags [P.], seq 8689:9811, ack 117, win 91, options [nop,nop,TS val 311966 ecr 312025], length 1122
11:30:45.499812 IP 1.1.2.3.39449 > 5.6.7.8.http: Flags [.], ack 8689, win 363, options [nop,nop,TS val 312026 ecr 311966], length 0
11:30:45.499829 IP 1.1.2.3.39449 > 5.6.7.8.http: Flags [.], ack 9811, win 408, options [nop,nop,TS val 312026 ecr 311966], length 0
11:30:45.500241 IP 1.1.2.3.39449 > 5.6.7.8.http: Flags [F.], seq 117, ack 9811, win 408, options [nop,nop,TS val 312026 ecr 311966], length 0
11:30:45.500500 IP 5.6.7.8.http > 1.1.2.3.39449: Flags [F.], seq 9811, ack 118, win 91, options [nop,nop,TS val 311966 ecr 312026], length 0
11:30:45.500527 IP 1.1.2.3.39449 > 5.6.7.8.http: Flags [.], ack 9812, win 408, options [nop,nop,TS val 312026 ecr 311966], length 0
11:30:45.518331 IP 1.1.2.3.39450 > 5.6.7.8.http: Flags [S], seq 104778637, win 5840, options [mss 1460,sackOK,TS val 312030 ecr 0,nop,wscale 6], length 0
11:30:45.518520 IP 5.6.7.8.http > 1.1.2.3.39450: Flags [S.], seq 1107333034, ack 104778638, win 5792, options [mss 1460,sackOK,TS val 311971 ecr 312030,nop,wscale 6], length 0
11:30:45.518553 IP 1.1.2.3.39450 > 5.6.7.8.http: Flags [.], ack 1, win 92, options [nop,nop,TS val 312030 ecr 311971], length 0
11:30:45.518616 IP 1.1.2.3.39450 > 5.6.7.8.http: Flags [P.], seq 1:117, ack 1, win 92, options [nop,nop,TS val 312030 ecr 311971], length 116
11:30:45.518818 IP 5.6.7.8.http > 1.1.2.3.39450: Flags [.], ack 117, win 91, options [nop,nop,TS val 311971 ecr 312030], length 0
11:30:45.521564 IP 5.6.7.8.http > 1.1.2.3.39450: Flags [.], seq 1:1449, ack 117, win 91, options [nop,nop,TS val 311972 ecr 312030], length 1448
11:30:45.521576 IP 1.1.2.3.39450 > 5.6.7.8.http: Flags [.], ack 1449, win 137, options [nop,nop,TS val 312031 ecr 311972], length 0
11:30:45.521583 IP 5.6.7.8.http > 1.1.2.3.39450: Flags [.], seq 1449:2897, ack 117, win 91, options [nop,nop,TS val 311972 ecr 312030], length 1448
11:30:45.521590 IP 1.1.2.3.39450 > 5.6.7.8.http: Flags [.], ack 2897, win 182, options [nop,nop,TS val 312031 ecr 311972], length 0
11:30:45.521595 IP 5.6.7.8.http > 1.1.2.3.39450: Flags [.], seq 2897:4345, ack 117, win 91, options [nop,nop,TS val 311972 ecr 312030], length 1448
11:30:45.521604 IP 1.1.2.3.39450 > 5.6.7.8.http: Flags [.], ack 4345, win 227, options [nop,nop,TS val 312031 ecr 311972], length 0
11:30:45.521815 IP 5.6.7.8.http > 1.1.2.3.39450: Flags [P.], seq 4345:4912, ack 117, win 91, options [nop,nop,TS val 311972 ecr 312031], length 567
11:30:45.521829 IP 1.1.2.3.39450 > 5.6.7.8.http: Flags [.], ack 4912, win 273, options [nop,nop,TS val 312031 ecr 311972], length 0
11:30:45.522246 IP 1.1.2.3.39450 > 5.6.7.8.http: Flags [F.], seq 117, ack 4912, win 273, options [nop,nop,TS val 312031 ecr 311972], length 0
11:30:45.522464 IP 5.6.7.8.http > 1.1.2.3.39450: Flags [F.], seq 4912, ack 118, win 91, options [nop,nop,TS val 311972 ecr 312031], length 0
11:30:45.522487 IP 1.1.2.3.39450 > 5.6.7.8.http: Flags [.], ack 4913, win 273, options [nop,nop,TS val 312031 ecr 311972], length 0
11:30:45.571853 IP 1.1.2.3.39451 > 5.6.7.8.http: Flags [S], seq 1869571840, win 5840, options [mss 1460,sackOK,TS val 312044 ecr 0,nop,wscale 6], length 0
11:30:45.572036 IP 5.6.7.8.http > 1.1.2.3.39451: Flags [S.], seq 3912435943, ack 1869571841, win 5792, options [mss 1460,sackOK,TS val 311984 ecr 312044,nop,wscale 6], length 0
11:30:45.572070 IP 1.1.2.3.39451 > 5.6.7.8.http: Flags [.], ack 1, win 92, options [nop,nop,TS val 312044 ecr 311984], length 0
11:30:45.572127 IP 1.1.2.3.39451 > 5.6.7.8.http: Flags [P.], seq 1:117, ack 1, win 92, options [nop,nop,TS val 312044 ecr 311984], length 116
11:30:45.572332 IP 5.6.7.8.http > 1.1.2.3.39451: Flags [.], ack 117, win 91, options [nop,nop,TS val 311984 ecr 312044], length 0
11:30:45.574977 IP 5.6.7.8.http > 1.1.2.3.39451: Flags [.], seq 1:1449, ack 117, win 91, options [nop,nop,TS val 311985 ecr 312044], length 1448
11:30:45.574988 IP 1.1.2.3.39451 > 5.6.7.8.http: Flags [.], ack 1449, win 137, options [nop,nop,TS val 312044 ecr 311985], length 0
11:30:45.574995 IP 5.6.7.8.http > 1.1.2.3.39451: Flags [.], seq 1449:2897, ack 117, win 91, options [nop,nop,TS val 311985 ecr 312044], length 1448
11:30:45.575002 IP 1.1.2.3.39451 > 5.6.7.8.http: Flags [.], ack 2897, win 182, options [nop,nop,TS val 312044 ecr 311985], length 0
11:30:45.575007 IP 5.6.7.8.http > 1.1.2.3.39451: Flags [P.], seq 2897:3486, ack 117, win 91, options [nop,nop,TS val 311985 ecr 312044], length 589
11:30:45.575016 IP 1.1.2.3.39451 > 5.6.7.8.http: Flags [.], ack 3486, win 227, options [nop,nop,TS val 312044 ecr 311985], length 0
11:30:45.575536 IP 1.1.2.3.39451 > 5.6.7.8.http: Flags [F.], seq 117, ack 3486, win 227, options [nop,nop,TS val 312045 ecr 311985], length 0
11:30:45.575778 IP 5.6.7.8.http > 1.1.2.3.39451: Flags [F.], seq 3486, ack 118, win 91, options [nop,nop,TS val 311985 ecr 312045], length 0
11:30:45.575802 IP 1.1.2.3.39451 > 5.6.7.8.http: Flags [.], ack 3487, win 227, options [nop,nop,TS val 312045 ecr 311985], length 0
11:30:45.623339 IP 1.1.2.3.39452 > 5.6.7.8.http: Flags [S], seq 2914572390, win 5840, options [mss 1460,sackOK,TS val 312056 ecr 0,nop,wscale 6], length 0
11:30:45.623551 IP 5.6.7.8.http > 1.1.2.3.39452: Flags [S.], seq 1740286226, ack 2914572391, win 5792, options [mss 1460,sackOK,TS val 311997 ecr 312056,nop,wscale 6], length 0
11:30:45.623586 IP 1.1.2.3.39452 > 5.6.7.8.http: Flags [.], ack 1, win 92, options [nop,nop,TS val 312057 ecr 311997], length 0
11:30:45.623654 IP 1.1.2.3.39452 > 5.6.7.8.http: Flags [P.], seq 1:117, ack 1, win 92, options [nop,nop,TS val 312057 ecr 311997], length 116
11:30:45.623848 IP 5.6.7.8.http > 1.1.2.3.39452: Flags [.], ack 117, win 91, options [nop,nop,TS val 311997 ecr 312057], length 0
11:30:45.626694 IP 5.6.7.8.http > 1.1.2.3.39452: Flags [.], seq 1:1449, ack 117, win 91, options [nop,nop,TS val 311998 ecr 312057], length 1448
11:30:45.626705 IP 1.1.2.3.39452 > 5.6.7.8.http: Flags [.], ack 1449, win 137, options [nop,nop,TS val 312057 ecr 311998], length 0
11:30:45.626712 IP 5.6.7.8.http > 1.1.2.3.39452: Flags [.], seq 1449:2897, ack 117, win 91, options [nop,nop,TS val 311998 ecr 312057], length 1448
11:30:45.626719 IP 1.1.2.3.39452 > 5.6.7.8.http: Flags [.], ack 2897, win 182, options [nop,nop,TS val 312057 ecr 311998], length 0
11:30:45.626723 IP 5.6.7.8.http > 1.1.2.3.39452: Flags [.], seq 2897:4345, ack 117, win 91, options [nop,nop,TS val 311998 ecr 312057], length 1448
11:30:45.626732 IP 1.1.2.3.39452 > 5.6.7.8.http: Flags [.], ack 4345, win 227, options [nop,nop,TS val 312057 ecr 311998], length 0
11:30:45.626994 IP 5.6.7.8.http > 1.1.2.3.39452: Flags [.], seq 4345:5793, ack 117, win 91, options [nop,nop,TS val 311998 ecr 312057], length 1448
11:30:45.627008 IP 1.1.2.3.39452 > 5.6.7.8.http: Flags [.], ack 5793, win 273, options [nop,nop,TS val 312057 ecr 311998], length 0
11:30:45.627015 IP 5.6.7.8.http > 1.1.2.3.39452: Flags [P.], seq 5793:5991, ack 117, win 91, options [nop,nop,TS val 311998 ecr 312057], length 198
11:30:45.627022 IP 1.1.2.3.39452 > 5.6.7.8.http: Flags [.], ack 5991, win 318, options [nop,nop,TS val 312057 ecr 311998], length 0
11:30:45.627440 IP 1.1.2.3.39452 > 5.6.7.8.http: Flags [F.], seq 117, ack 5991, win 318, options [nop,nop,TS val 312057 ecr 311998], length 0
11:30:45.627693 IP 5.6.7.8.http > 1.1.2.3.39452: Flags [F.], seq 5991, ack 118, win 91, options [nop,nop,TS val 311998 ecr 312057], length 0
11:30:45.627717 IP 1.1.2.3.39452 > 5.6.7.8.http: Flags [.], ack 5992, win 318, options [nop,nop,TS val 312058 ecr 311998], length 0
11:30:45.658750 IP 1.1.2.3.39453 > 5.6.7.8.http: Flags [S], seq 696907985, win 5840, options [mss 1460,sackOK,TS val 312065 ecr 0,nop,wscale 6], length 0
11:30:45.658943 IP 5.6.7.8.http > 1.1.2.3.39453: Flags [S.], seq 306014271, ack 696907986, win 5792, options [mss 1460,sackOK,TS val 312006 ecr 312065,nop,wscale 6], length 0
11:30:45.658991 IP 1.1.2.3.39453 > 5.6.7.8.http: Flags [.], ack 1, win 92, options [nop,nop,TS val 312065 ecr 312006], length 0
11:30:45.659073 IP 1.1.2.3.39453 > 5.6.7.8.http: Flags [P.], seq 1:117, ack 1, win 92, options [nop,nop,TS val 312065 ecr 312006], length 116
11:30:45.659241 IP 5.6.7.8.http > 1.1.2.3.39453: Flags [.], ack 117, win 91, options [nop,nop,TS val 312006 ecr 312065], length 0
11:30:45.661937 IP 5.6.7.8.http > 1.1.2.3.39453: Flags [.], seq 1:1449, ack 117, win 91, options [nop,nop,TS val 312007 ecr 312065], length 1448
11:30:45.661948 IP 1.1.2.3.39453 > 5.6.7.8.http: Flags [.], ack 1449, win 137, options [nop,nop,TS val 312066 ecr 312007], length 0
11:30:45.661955 IP 5.6.7.8.http > 1.1.2.3.39453: Flags [.], seq 1449:2897, ack 117, win 91, options [nop,nop,TS val 312007 ecr 312065], length 1448
11:30:45.661962 IP 1.1.2.3.39453 > 5.6.7.8.http: Flags [.], ack 2897, win 182, options [nop,nop,TS val 312066 ecr 312007], length 0
11:30:45.661967 IP 5.6.7.8.http > 1.1.2.3.39453: Flags [.], seq 2897:4345, ack 117, win 91, options [nop,nop,TS val 312007 ecr 312065], length 1448
11:30:45.661975 IP 1.1.2.3.39453 > 5.6.7.8.http: Flags [.], ack 4345, win 227, options [nop,nop,TS val 312066 ecr 312007], length 0
11:30:45.662188 IP 5.6.7.8.http > 1.1.2.3.39453: Flags [P.], seq 4345:4945, ack 117, win 91, options [nop,nop,TS val 312007 ecr 312066], length 600
11:30:45.662203 IP 1.1.2.3.39453 > 5.6.7.8.http: Flags [.], ack 4945, win 273, options [nop,nop,TS val 312066 ecr 312007], length 0
11:30:45.662619 IP 1.1.2.3.39453 > 5.6.7.8.http: Flags [F.], seq 117, ack 4945, win 273, options [nop,nop,TS val 312066 ecr 312007], length 0
11:30:45.662837 IP 5.6.7.8.http > 1.1.2.3.39453: Flags [F.], seq 4945, ack 118, win 91, options [nop,nop,TS val 312007 ecr 312066], length 0
11:30:45.662860 IP 1.1.2.3.39453 > 5.6.7.8.http: Flags [.], ack 4946, win 273, options [nop,nop,TS val 312066 ecr 312007], length 0
11:30:45.682284 IP 1.1.2.3.39454 > 5.6.7.8.http: Flags [S], seq 1678421694, win 5840, options [mss 1460,sackOK,TS val 312071 ecr 0,nop,wscale 6], length 0
11:30:45.682505 IP 5.6.7.8.http > 1.1.2.3.39454: Flags [S.], seq 3300563103, ack 1678421695, win 5792, options [mss 1460,sackOK,TS val 312012 ecr 312071,nop,wscale 6], length 0
11:30:45.682538 IP 1.1.2.3.39454 > 5.6.7.8.http: Flags [.], ack 1, win 92, options [nop,nop,TS val 312071 ecr 312012], length 0
11:30:45.682589 IP 1.1.2.3.39454 > 5.6.7.8.http: Flags [P.], seq 1:117, ack 1, win 92, options [nop,nop,TS val 312071 ecr 312012], length 116
11:30:45.682753 IP 5.6.7.8.http > 1.1.2.3.39454: Flags [.], ack 117, win 91, options [nop,nop,TS val 312012 ecr 312071], length 0
11:30:45.685250 IP 5.6.7.8.http > 1.1.2.3.39454: Flags [.], seq 1:1449, ack 117, win 91, options [nop,nop,TS val 312013 ecr 312071], length 1448
11:30:45.685261 IP 1.1.2.3.39454 > 5.6.7.8.http: Flags [.], ack 1449, win 137, options [nop,nop,TS val 312072 ecr 312013], length 0
11:30:45.685268 IP 5.6.7.8.http > 1.1.2.3.39454: Flags [P.], seq 1449:2360, ack 117, win 91, options [nop,nop,TS val 312013 ecr 312071], length 911
11:30:45.685275 IP 1.1.2.3.39454 > 5.6.7.8.http: Flags [.], ack 2360, win 182, options [nop,nop,TS val 312072 ecr 312013], length 0
11:30:45.685781 IP 1.1.2.3.39454 > 5.6.7.8.http: Flags [F.], seq 117, ack 2360, win 182, options [nop,nop,TS val 312072 ecr 312013], length 0
11:30:45.686049 IP 5.6.7.8.http > 1.1.2.3.39454: Flags [F.], seq 2360, ack 118, win 91, options [nop,nop,TS val 312013 ecr 312072], length 0
11:30:45.686072 IP 1.1.2.3.39454 > 5.6.7.8.http: Flags [.], ack 2361, win 182, options [nop,nop,TS val 312072 ecr 312013], length 0
11:30:45.706520 IP 1.1.2.3.39455 > 5.6.7.8.http: Flags [S], seq 1911726730, win 5840, options [mss 1460,sackOK,TS val 312077 ecr 0,nop,wscale 6], length 0
11:30:45.706717 IP 5.6.7.8.http > 1.1.2.3.39455: Flags [S.], seq 3975342249, ack 1911726731, win 5792, options [mss 1460,sackOK,TS val 312018 ecr 312077,nop,wscale 6], length 0
11:30:45.706749 IP 1.1.2.3.39455 > 5.6.7.8.http: Flags [.], ack 1, win 92, options [nop,nop,TS val 312077 ecr 312018], length 0
11:30:45.706799 IP 1.1.2.3.39455 > 5.6.7.8.http: Flags [P.], seq 1:117, ack 1, win 92, options [nop,nop,TS val 312077 ecr 312018], length 116
11:30:45.706980 IP 5.6.7.8.http > 1.1.2.3.39455: Flags [.], ack 117, win 91, options [nop,nop,TS val 312018 ecr 312077], length 0
11:30:45.709410 IP 5.6.7.8.http > 1.1.2.3.39455: Flags [.], seq 1:1449, ack 117, win 91, options [nop,nop,TS val 312019 ecr 312077], length 1448
11:30:45.709421 IP 1.1.2.3.39455 > 5.6.7.8.http: Flags [.], ack 1449, win 137, options [nop,nop,TS val 312078 ecr 312019], length 0
11:30:45.709428 IP 5.6.7.8.http > 1.1.2.3.39455: Flags [P.], seq 1449:1942, ack 117, win 91, options [nop,nop,TS val 312019 ecr 312077], length 493
11:30:45.709435 IP 1.1.2.3.39455 > 5.6.7.8.http: Flags [.], ack 1942, win 182, options [nop,nop,TS val 312078 ecr 312019], length 0
11:30:45.709936 IP 1.1.2.3.39455 > 5.6.7.8.http: Flags [F.], seq 117, ack 1942, win 182, options [nop,nop,TS val 312078 ecr 312019], length 0
11:30:45.710160 IP 5.6.7.8.http > 1.1.2.3.39455: Flags [F.], seq 1942, ack 118, win 91, options [nop,nop,TS val 312019 ecr 312078], length 0
11:30:45.710184 IP 1.1.2.3.39455 > 5.6.7.8.http: Flags [.], ack 1943, win 182, options [nop,nop,TS val 312078 ecr 312019], length 0
11:30:45.723901 IP 1.1.2.3.39456 > 5.6.7.8.http: Flags [S], seq 798133891, win 5840, options [mss 1460,sackOK,TS val 312082 ecr 0,nop,wscale 6], length 0
11:30:45.724088 IP 5.6.7.8.http > 1.1.2.3.39456: Flags [S.], seq 4205702319, ack 798133892, win 5792, options [mss 1460,sackOK,TS val 312022 ecr 312082,nop,wscale 6], length 0
11:30:45.724122 IP 1.1.2.3.39456 > 5.6.7.8.http: Flags [.], ack 1, win 92, options [nop,nop,TS val 312082 ecr 312022], length 0
11:30:45.724174 IP 1.1.2.3.39456 > 5.6.7.8.http: Flags [P.], seq 1:117, ack 1, win 92, options [nop,nop,TS val 312082 ecr 312022], length 116
11:30:45.724336 IP 5.6.7.8.http > 1.1.2.3.39456: Flags [.], ack 117, win 91, options [nop,nop,TS val 312022 ecr 312082], length 0
11:30:45.726881 IP 5.6.7.8.http > 1.1.2.3.39456: Flags [.], seq 1:1449, ack 117, win 91, options [nop,nop,TS val 312023 ecr 312082], length 1448
11:30:45.726892 IP 1.1.2.3.39456 > 5.6.7.8.http: Flags [.], ack 1449, win 137, options [nop,nop,TS val 312082 ecr 312023], length 0
11:30:45.726899 IP 5.6.7.8.http > 1.1.2.3.39456: Flags [P.], seq 1449:2447, ack 117, win 91, options [nop,nop,TS val 312023 ecr 312082], length 998
11:30:45.726906 IP 1.1.2.3.39456 > 5.6.7.8.http: Flags [.], ack 2447, win 182, options [nop,nop,TS val 312082 ecr 312023], length 0
11:30:45.727427 IP 1.1.2.3.39456 > 5.6.7.8.http: Flags [F.], seq 117, ack 2447, win 182, options [nop,nop,TS val 312083 ecr 312023], length 0
11:30:45.727682 IP 5.6.7.8.http > 1.1.2.3.39456: Flags [F.], seq 2447, ack 118, win 91, options [nop,nop,TS val 312023 ecr 312083], length 0
11:30:45.727706 IP 1.1.2.3.39456 > 5.6.7.8.http: Flags [.], ack 2448, win 182, options [nop,nop,TS val 312083 ecr 312023], length 0
11:30:45.741092 IP 1.1.2.3.39457 > 5.6.7.8.http: Flags [S], seq 2403569253, win 5840, options [mss 1460,sackOK,TS val 312086 ecr 0,nop,wscale 6], length 0
11:30:45.741311 IP 5.6.7.8.http > 1.1.2.3.39457: Flags [S.], seq 3834120487, ack 2403569254, win 5792, options [mss 1460,sackOK,TS val 312026 ecr 312086,nop,wscale 6], length 0
11:30:45.741343 IP 1.1.2.3.39457 > 5.6.7.8.http: Flags [.], ack 1, win 92, options [nop,nop,TS val 312086 ecr 312026], length 0
11:30:45.741396 IP 1.1.2.3.39457 > 5.6.7.8.http: Flags [P.], seq 1:117, ack 1, win 92, options [nop,nop,TS val 312086 ecr 312026], length 116
11:30:45.741558 IP 5.6.7.8.http > 1.1.2.3.39457: Flags [.], ack 117, win 91, options [nop,nop,TS val 312027 ecr 312086], length 0
11:30:45.744454 IP 5.6.7.8.http > 1.1.2.3.39457: Flags [.], seq 1:1449, ack 117, win 91, options [nop,nop,TS val 312027 ecr 312086], length 1448
11:30:45.744466 IP 1.1.2.3.39457 > 5.6.7.8.http: Flags [.], ack 1449, win 137, options [nop,nop,TS val 312087 ecr 312027], length 0
11:30:45.744473 IP 5.6.7.8.http > 1.1.2.3.39457: Flags [.], seq 1449:2897, ack 117, win 91, options [nop,nop,TS val 312027 ecr 312086], length 1448
11:30:45.744480 IP 1.1.2.3.39457 > 5.6.7.8.http: Flags [.], ack 2897, win 182, options [nop,nop,TS val 312087 ecr 312027], length 0
11:30:45.744485 IP 5.6.7.8.http > 1.1.2.3.39457: Flags [.], seq 2897:4345, ack 117, win 91, options [nop,nop,TS val 312027 ecr 312086], length 1448
11:30:45.744493 IP 1.1.2.3.39457 > 5.6.7.8.http: Flags [.], ack 4345, win 227, options [nop,nop,TS val 312087 ecr 312027], length 0
11:30:45.744753 IP 5.6.7.8.http > 1.1.2.3.39457: Flags [.], seq 4345:5793, ack 117, win 91, options [nop,nop,TS val 312027 ecr 312087], length 1448
11:30:45.744768 IP 1.1.2.3.39457 > 5.6.7.8.http: Flags [.], ack 5793, win 273, options [nop,nop,TS val 312087 ecr 312027], length 0
11:30:45.744774 IP 5.6.7.8.http > 1.1.2.3.39457: Flags [P.], seq 5793:6926, ack 117, win 91, options [nop,nop,TS val 312027 ecr 312087], length 1133
11:30:45.744781 IP 1.1.2.3.39457 > 5.6.7.8.http: Flags [.], ack 6926, win 318, options [nop,nop,TS val 312087 ecr 312027], length 0
11:30:45.745210 IP 1.1.2.3.39457 > 5.6.7.8.http: Flags [F.], seq 117, ack 6926, win 318, options [nop,nop,TS val 312087 ecr 312027], length 0
11:30:45.745453 IP 5.6.7.8.http > 1.1.2.3.39457: Flags [F.], seq 6926, ack 118, win 91, options [nop,nop,TS val 312027 ecr 312087], length 0
11:30:45.745477 IP 1.1.2.3.39457 > 5.6.7.8.http: Flags [.], ack 6927, win 318, options [nop,nop,TS val 312087 ecr 312027], length 0
11:30:45.884913 IP 1.1.2.3.39458 > 5.6.7.8.http: Flags [S], seq 957771299, win 5840, options [mss 1460,sackOK,TS val 312122 ecr 0,nop,wscale 6], length 0
11:30:45.885128 IP 5.6.7.8.http > 1.1.2.3.39458: Flags [S.], seq 3147400451, ack 957771300, win 5792, options [mss 1460,sackOK,TS val 312063 ecr 312122,nop,wscale 6], length 0
11:30:45.885161 IP 1.1.2.3.39458 > 5.6.7.8.http: Flags [.], ack 1, win 92, options [nop,nop,TS val 312122 ecr 312063], length 0
11:30:45.885217 IP 1.1.2.3.39458 > 5.6.7.8.http: Flags [P.], seq 1:117, ack 1, win 92, options [nop,nop,TS val 312122 ecr 312063], length 116
11:30:45.885375 IP 5.6.7.8.http > 1.1.2.3.39458: Flags [.], ack 117, win 91, options [nop,nop,TS val 312063 ecr 312122], length 0
11:30:45.887921 IP 5.6.7.8.http > 1.1.2.3.39458: Flags [.], seq 1:1449, ack 117, win 91, options [nop,nop,TS val 312063 ecr 312122], length 1448
11:30:45.887931 IP 1.1.2.3.39458 > 5.6.7.8.http: Flags [.], ack 1449, win 137, options [nop,nop,TS val 312123 ecr 312063], length 0
11:30:45.887939 IP 5.6.7.8.http > 1.1.2.3.39458: Flags [P.], seq 1449:2588, ack 117, win 91, options [nop,nop,TS val 312063 ecr 312122], length 1139
11:30:45.887946 IP 1.1.2.3.39458 > 5.6.7.8.http: Flags [.], ack 2588, win 182, options [nop,nop,TS val 312123 ecr 312063], length 0
11:30:45.888457 IP 1.1.2.3.39458 > 5.6.7.8.http: Flags [F.], seq 117, ack 2588, win 182, options [nop,nop,TS val 312123 ecr 312063], length 0
11:30:45.888722 IP 5.6.7.8.http > 1.1.2.3.39458: Flags [F.], seq 2588, ack 118, win 91, options [nop,nop,TS val 312063 ecr 312123], length 0
11:30:45.888746 IP 1.1.2.3.39458 > 5.6.7.8.http: Flags [.], ack 2589, win 182, options [nop,nop,TS val 312123 ecr 312063], length 0
11:30:46.273236 IP 1.1.2.3.39459 > 5.6.7.8.http: Flags [S], seq 3381011626, win 5840, options [mss 1460,sackOK,TS val 312219 ecr 0,nop,wscale 6], length 0
11:30:46.273549 IP 5.6.7.8.http > 1.1.2.3.39459: Flags [S.], seq 1578737856, ack 3381011627, win 5792, options [mss 1460,sackOK,TS val 312160 ecr 312219,nop,wscale 6], length 0
11:30:46.273581 IP 1.1.2.3.39459 > 5.6.7.8.http: Flags [.], ack 1, win 92, options [nop,nop,TS val 312219 ecr 312160], length 0
11:30:46.273648 IP 1.1.2.3.39459 > 5.6.7.8.http: Flags [P.], seq 1:117, ack 1, win 92, options [nop,nop,TS val 312219 ecr 312160], length 116
11:30:46.273846 IP 5.6.7.8.http > 1.1.2.3.39459: Flags [.], ack 117, win 91, options [nop,nop,TS val 312160 ecr 312219], length 0
11:30:46.276542 IP 5.6.7.8.http > 1.1.2.3.39459: Flags [.], seq 1:1449, ack 117, win 91, options [nop,nop,TS val 312160 ecr 312219], length 1448
11:30:46.276554 IP 1.1.2.3.39459 > 5.6.7.8.http: Flags [.], ack 1449, win 137, options [nop,nop,TS val 312220 ecr 312160], length 0
11:30:46.276561 IP 5.6.7.8.http > 1.1.2.3.39459: Flags [.], seq 1449:2897, ack 117, win 91, options [nop,nop,TS val 312160 ecr 312219], length 1448
11:30:46.276568 IP 1.1.2.3.39459 > 5.6.7.8.http: Flags [.], ack 2897, win 182, options [nop,nop,TS val 312220 ecr 312160], length 0
11:30:46.276572 IP 5.6.7.8.http > 1.1.2.3.39459: Flags [P.], seq 2897:3357, ack 117, win 91, options [nop,nop,TS val 312160 ecr 312219], length 460
11:30:46.276581 IP 1.1.2.3.39459 > 5.6.7.8.http: Flags [.], ack 3357, win 227, options [nop,nop,TS val 312220 ecr 312160], length 0
11:30:46.277100 IP 1.1.2.3.39459 > 5.6.7.8.http: Flags [F.], seq 117, ack 3357, win 227, options [nop,nop,TS val 312220 ecr 312160], length 0
11:30:46.277342 IP 5.6.7.8.http > 1.1.2.3.39459: Flags [F.], seq 3357, ack 118, win 91, options [nop,nop,TS val 312161 ecr 312220], length 0
11:30:46.277366 IP 1.1.2.3.39459 > 5.6.7.8.http: Flags [.], ack 3358, win 227, options [nop,nop,TS val 312220 ecr 312161], length 0
11:30:46.620504 IP 1.1.2.3.39460 > 5.6.7.8.http: Flags [S], seq 212435512, win 5840, options [mss 1460,sackOK,TS val 312306 ecr 0,nop,wscale 6], length 0
11:30:46.620736 IP 5.6.7.8.http > 1.1.2.3.39460: Flags [S.], seq 3664973273, ack 212435513, win 5792, options [mss 1460,sackOK,TS val 312246 ecr 312306,nop,wscale 6], length 0
11:30:46.620770 IP 1.1.2.3.39460 > 5.6.7.8.http: Flags [.], ack 1, win 92, options [nop,nop,TS val 312306 ecr 312246], length 0
11:30:46.620821 IP 1.1.2.3.39460 > 5.6.7.8.http: Flags [P.], seq 1:117, ack 1, win 92, options [nop,nop,TS val 312306 ecr 312246], length 116
11:30:46.620984 IP 5.6.7.8.http > 1.1.2.3.39460: Flags [.], ack 117, win 91, options [nop,nop,TS val 312246 ecr 312306], length 0
11:30:46.623680 IP 5.6.7.8.http > 1.1.2.3.39460: Flags [.], seq 1:1449, ack 117, win 91, options [nop,nop,TS val 312247 ecr 312306], length 1448
11:30:46.623691 IP 1.1.2.3.39460 > 5.6.7.8.http: Flags [.], ack 1449, win 137, options [nop,nop,TS val 312307 ecr 312247], length 0
11:30:46.623699 IP 5.6.7.8.http > 1.1.2.3.39460: Flags [.], seq 1449:2897, ack 117, win 91, options [nop,nop,TS val 312247 ecr 312306], length 1448
11:30:46.623716 IP 1.1.2.3.39460 > 5.6.7.8.http: Flags [.], ack 2897, win 182, options [nop,nop,TS val 312307 ecr 312247], length 0
11:30:46.623721 IP 5.6.7.8.http > 1.1.2.3.39460: Flags [P.], seq 2897:3929, ack 117, win 91, options [nop,nop,TS val 312247 ecr 312306], length 1032
11:30:46.623733 IP 1.1.2.3.39460 > 5.6.7.8.http: Flags [.], ack 3929, win 227, options [nop,nop,TS val 312307 ecr 312247], length 0
11:30:46.624228 IP 1.1.2.3.39460 > 5.6.7.8.http: Flags [F.], seq 117, ack 3929, win 227, options [nop,nop,TS val 312307 ecr 312247], length 0
11:30:46.624530 IP 5.6.7.8.http > 1.1.2.3.39460: Flags [F.], seq 3929, ack 118, win 91, options [nop,nop,TS val 312247 ecr 312307], length 0
11:30:46.624556 IP 1.1.2.3.39460 > 5.6.7.8.http: Flags [.], ack 3930, win 227, options [nop,nop,TS val 312307 ecr 312247], length 0
11:30:46.707495 IP 1.1.2.3.39461 > 5.6.7.8.http: Flags [S], seq 3304528272, win 5840, options [mss 1460,sackOK,TS val 312327 ecr 0,nop,wscale 6], length 0
11:30:46.707746 IP 5.6.7.8.http > 1.1.2.3.39461: Flags [S.], seq 1509668961, ack 3304528273, win 5792, options [mss 1460,sackOK,TS val 312268 ecr 312327,nop,wscale 6], length 0
11:30:46.707778 IP 1.1.2.3.39461 > 5.6.7.8.http: Flags [.], ack 1, win 92, options [nop,nop,TS val 312327 ecr 312268], length 0
11:30:46.707830 IP 1.1.2.3.39461 > 5.6.7.8.http: Flags [P.], seq 1:117, ack 1, win 92, options [nop,nop,TS val 312327 ecr 312268], length 116
11:30:46.708044 IP 5.6.7.8.http > 1.1.2.3.39461: Flags [.], ack 117, win 91, options [nop,nop,TS val 312268 ecr 312327], length 0
11:30:46.710739 IP 5.6.7.8.http > 1.1.2.3.39461: Flags [.], seq 1:1449, ack 117, win 91, options [nop,nop,TS val 312269 ecr 312327], length 1448
11:30:46.710749 IP 1.1.2.3.39461 > 5.6.7.8.http: Flags [.], ack 1449, win 137, options [nop,nop,TS val 312328 ecr 312269], length 0
11:30:46.710757 IP 5.6.7.8.http > 1.1.2.3.39461: Flags [.], seq 1449:2897, ack 117, win 91, options [nop,nop,TS val 312269 ecr 312327], length 1448
11:30:46.710764 IP 1.1.2.3.39461 > 5.6.7.8.http: Flags [.], ack 2897, win 182, options [nop,nop,TS val 312328 ecr 312269], length 0
11:30:46.710768 IP 5.6.7.8.http > 1.1.2.3.39461: Flags [P.], seq 2897:4059, ack 117, win 91, options [nop,nop,TS val 312269 ecr 312327], length 1162
11:30:46.710777 IP 1.1.2.3.39461 > 5.6.7.8.http: Flags [.], ack 4059, win 227, options [nop,nop,TS val 312328 ecr 312269], length 0
11:30:46.711307 IP 1.1.2.3.39461 > 5.6.7.8.http: Flags [F.], seq 117, ack 4059, win 227, options [nop,nop,TS val 312328 ecr 312269], length 0
11:30:46.711589 IP 5.6.7.8.http > 1.1.2.3.39461: Flags [F.], seq 4059, ack 118, win 91, options [nop,nop,TS val 312269 ecr 312328], length 0
11:30:46.711614 IP 1.1.2.3.39461 > 5.6.7.8.http: Flags [.], ack 4060, win 227, options [nop,nop,TS val 312328 ecr 312269], length 0
11:30:46.843099 IP 1.1.2.3.39462 > 5.6.7.8.http: Flags [S], seq 2296091012, win 5840, options [mss 1460,sackOK,TS val 312361 ecr 0,nop,wscale 6], length 0
11:30:46.843327 IP 5.6.7.8.http > 1.1.2.3.39462: Flags [S.], seq 2394153535, ack 2296091013, win 5792, options [mss 1460,sackOK,TS val 312302 ecr 312361,nop,wscale 6], length 0
11:30:46.843361 IP 1.1.2.3.39462 > 5.6.7.8.http: Flags [.], ack 1, win 92, options [nop,nop,TS val 312361 ecr 312302], length 0
11:30:46.843410 IP 1.1.2.3.39462 > 5.6.7.8.http: Flags [P.], seq 1:117, ack 1, win 92, options [nop,nop,TS val 312361 ecr 312302], length 116
11:30:46.843623 IP 5.6.7.8.http > 1.1.2.3.39462: Flags [.], ack 117, win 91, options [nop,nop,TS val 312302 ecr 312361], length 0
11:30:46.846569 IP 5.6.7.8.http > 1.1.2.3.39462: Flags [.], seq 1:1449, ack 117, win 91, options [nop,nop,TS val 312303 ecr 312361], length 1448
11:30:46.846581 IP 1.1.2.3.39462 > 5.6.7.8.http: Flags [.], ack 1449, win 137, options [nop,nop,TS val 312362 ecr 312303], length 0
11:30:46.846588 IP 5.6.7.8.http > 1.1.2.3.39462: Flags [.], seq 1449:2897, ack 117, win 91, options [nop,nop,TS val 312303 ecr 312361], length 1448
11:30:46.846595 IP 1.1.2.3.39462 > 5.6.7.8.http: Flags [.], ack 2897, win 182, options [nop,nop,TS val 312362 ecr 312303], length 0
11:30:46.846600 IP 5.6.7.8.http > 1.1.2.3.39462: Flags [.], seq 2897:4345, ack 117, win 91, options [nop,nop,TS val 312303 ecr 312361], length 1448
11:30:46.846608 IP 1.1.2.3.39462 > 5.6.7.8.http: Flags [.], ack 4345, win 227, options [nop,nop,TS val 312362 ecr 312303], length 0
11:30:46.846869 IP 5.6.7.8.http > 1.1.2.3.39462: Flags [.], seq 4345:5793, ack 117, win 91, options [nop,nop,TS val 312303 ecr 312362], length 1448
11:30:46.846883 IP 1.1.2.3.39462 > 5.6.7.8.http: Flags [.], ack 5793, win 273, options [nop,nop,TS val 312362 ecr 312303], length 0
11:30:46.846890 IP 5.6.7.8.http > 1.1.2.3.39462: Flags [P.], seq 5793:7241, ack 117, win 91, options [nop,nop,TS val 312303 ecr 312362], length 1448
11:30:46.846896 IP 1.1.2.3.39462 > 5.6.7.8.http: Flags [.], ack 7241, win 318, options [nop,nop,TS val 312362 ecr 312303], length 0
11:30:46.846901 IP 5.6.7.8.http > 1.1.2.3.39462: Flags [.], seq 7241:8689, ack 117, win 91, options [nop,nop,TS val 312303 ecr 312362], length 1448
11:30:46.846908 IP 1.1.2.3.39462 > 5.6.7.8.http: Flags [.], ack 8689, win 363, options [nop,nop,TS val 312362 ecr 312303], length 0
11:30:46.846912 IP 5.6.7.8.http > 1.1.2.3.39462: Flags [P.], seq 8689:9894, ack 117, win 91, options [nop,nop,TS val 312303 ecr 312362], length 1205
11:30:46.846919 IP 1.1.2.3.39462 > 5.6.7.8.http: Flags [.], ack 9894, win 408, options [nop,nop,TS val 312362 ecr 312303], length 0
11:30:46.847371 IP 1.1.2.3.39462 > 5.6.7.8.http: Flags [F.], seq 117, ack 9894, win 408, options [nop,nop,TS val 312363 ecr 312303], length 0
11:30:46.847569 IP 5.6.7.8.http > 1.1.2.3.39462: Flags [F.], seq 9894, ack 118, win 91, options [nop,nop,TS val 312303 ecr 312363], length 0
11:30:46.847593 IP 1.1.2.3.39462 > 5.6.7.8.http: Flags [.], ack 9895, win 408, options [nop,nop,TS val 312363 ecr 312303], length 0
11:30:47.148853 IP 1.1.2.3.39463 > 5.6.7.8.http: Flags [S], seq 2363071663, win 5840, options [mss 1460,sackOK,TS val 312438 ecr 0,nop,wscale 6], length 0
11:30:47.149131 IP 5.6.7.8.http > 1.1.2.3.39463: Flags [S.], seq 543530041, ack 2363071664, win 5792, options [mss 1460,sackOK,TS val 312379 ecr 312438,nop,wscale 6], length 0
11:30:47.149164 IP 1.1.2.3.39463 > 5.6.7.8.http: Flags [.], ack 1, win 92, options [nop,nop,TS val 312438 ecr 312379], length 0
11:30:47.149219 IP 1.1.2.3.39463 > 5.6.7.8.http: Flags [P.], seq 1:117, ack 1, win 92, options [nop,nop,TS val 312438 ecr 312379], length 116
11:30:47.149429 IP 5.6.7.8.http > 1.1.2.3.39463: Flags [.], ack 117, win 91, options [nop,nop,TS val 312379 ecr 312438], length 0
11:30:47.152423 IP 5.6.7.8.http > 1.1.2.3.39463: Flags [.], seq 1:1449, ack 117, win 91, options [nop,nop,TS val 312379 ecr 312438], length 1448
11:30:47.152435 IP 1.1.2.3.39463 > 5.6.7.8.http: Flags [.], ack 1449, win 137, options [nop,nop,TS val 312439 ecr 312379], length 0
11:30:47.152442 IP 5.6.7.8.http > 1.1.2.3.39463: Flags [.], seq 1449:2897, ack 117, win 91, options [nop,nop,TS val 312379 ecr 312438], length 1448
11:30:47.152448 IP 1.1.2.3.39463 > 5.6.7.8.http: Flags [.], ack 2897, win 182, options [nop,nop,TS val 312439 ecr 312379], length 0
11:30:47.152453 IP 5.6.7.8.http > 1.1.2.3.39463: Flags [.], seq 2897:4345, ack 117, win 91, options [nop,nop,TS val 312379 ecr 312438], length 1448
11:30:47.152462 IP 1.1.2.3.39463 > 5.6.7.8.http: Flags [.], ack 4345, win 227, options [nop,nop,TS val 312439 ecr 312379], length 0
11:30:47.152725 IP 5.6.7.8.http > 1.1.2.3.39463: Flags [.], seq 4345:5793, ack 117, win 91, options [nop,nop,TS val 312379 ecr 312439], length 1448
11:30:47.152739 IP 1.1.2.3.39463 > 5.6.7.8.http: Flags [.], ack 5793, win 273, options [nop,nop,TS val 312439 ecr 312379], length 0
11:30:47.152745 IP 5.6.7.8.http > 1.1.2.3.39463: Flags [P.], seq 5793:7241, ack 117, win 91, options [nop,nop,TS val 312379 ecr 312439], length 1448
11:30:47.152751 IP 1.1.2.3.39463 > 5.6.7.8.http: Flags [.], ack 7241, win 318, options [nop,nop,TS val 312439 ecr 312379], length 0
11:30:47.152756 IP 5.6.7.8.http > 1.1.2.3.39463: Flags [.], seq 7241:8689, ack 117, win 91, options [nop,nop,TS val 312379 ecr 312439], length 1448
11:30:47.152762 IP 1.1.2.3.39463 > 5.6.7.8.http: Flags [.], ack 8689, win 363, options [nop,nop,TS val 312439 ecr 312379], length 0
11:30:47.152767 IP 5.6.7.8.http > 1.1.2.3.39463: Flags [P.], seq 8689:10060, ack 117, win 91, options [nop,nop,TS val 312379 ecr 312439], length 1371
11:30:47.152773 IP 1.1.2.3.39463 > 5.6.7.8.http: Flags [.], ack 10060, win 408, options [nop,nop,TS val 312439 ecr 312379], length 0
11:30:47.153202 IP 1.1.2.3.39463 > 5.6.7.8.http: Flags [F.], seq 117, ack 10060, win 408, options [nop,nop,TS val 312439 ecr 312379], length 0
11:30:47.153473 IP 5.6.7.8.http > 1.1.2.3.39463: Flags [F.], seq 10060, ack 118, win 91, options [nop,nop,TS val 312379 ecr 312439], length 0
11:30:47.153497 IP 1.1.2.3.39463 > 5.6.7.8.http: Flags [.], ack 10061, win 408, options [nop,nop,TS val 312439 ecr 312379], length 0
11:30:47.429108 IP 1.1.2.3.39464 > 5.6.7.8.http: Flags [S], seq 336964897, win 5840, options [mss 1460,sackOK,TS val 312508 ecr 0,nop,wscale 6], length 0
11:30:47.429327 IP 5.6.7.8.http > 1.1.2.3.39464: Flags [S.], seq 807695455, ack 336964898, win 5792, options [mss 1460,sackOK,TS val 312449 ecr 312508,nop,wscale 6], length 0
11:30:47.429359 IP 1.1.2.3.39464 > 5.6.7.8.http: Flags [.], ack 1, win 92, options [nop,nop,TS val 312508 ecr 312449], length 0
11:30:47.429409 IP 1.1.2.3.39464 > 5.6.7.8.http: Flags [P.], seq 1:117, ack 1, win 92, options [nop,nop,TS val 312508 ecr 312449], length 116
11:30:47.429625 IP 5.6.7.8.http > 1.1.2.3.39464: Flags [.], ack 117, win 91, options [nop,nop,TS val 312449 ecr 312508], length 0
11:30:47.432020 IP 5.6.7.8.http > 1.1.2.3.39464: Flags [P.], seq 1:1303, ack 117, win 91, options [nop,nop,TS val 312449 ecr 312508], length 1302
11:30:47.432032 IP 1.1.2.3.39464 > 5.6.7.8.http: Flags [.], ack 1303, win 132, options [nop,nop,TS val 312509 ecr 312449], length 0
11:30:47.432540 IP 1.1.2.3.39464 > 5.6.7.8.http: Flags [F.], seq 117, ack 1303, win 132, options [nop,nop,TS val 312509 ecr 312449], length 0
11:30:47.432821 IP 5.6.7.8.http > 1.1.2.3.39464: Flags [F.], seq 1303, ack 118, win 91, options [nop,nop,TS val 312449 ecr 312509], length 0
11:30:47.432845 IP 1.1.2.3.39464 > 5.6.7.8.http: Flags [.], ack 1304, win 132, options [nop,nop,TS val 312509 ecr 312449], length 0
11:30:47.756116 IP 1.1.2.3.39465 > 5.6.7.8.http: Flags [S], seq 1028550134, win 5840, options [mss 1460,sackOK,TS val 312590 ecr 0,nop,wscale 6], length 0
11:30:47.756347 IP 5.6.7.8.http > 1.1.2.3.39465: Flags [S.], seq 897014702, ack 1028550135, win 5792, options [mss 1460,sackOK,TS val 312530 ecr 312590,nop,wscale 6], length 0
11:30:47.756381 IP 1.1.2.3.39465 > 5.6.7.8.http: Flags [.], ack 1, win 92, options [nop,nop,TS val 312590 ecr 312530], length 0
11:30:47.756436 IP 1.1.2.3.39465 > 5.6.7.8.http: Flags [P.], seq 1:117, ack 1, win 92, options [nop,nop,TS val 312590 ecr 312530], length 116
11:30:47.756645 IP 5.6.7.8.http > 1.1.2.3.39465: Flags [.], ack 117, win 91, options [nop,nop,TS val 312530 ecr 312590], length 0
11:30:47.759540 IP 5.6.7.8.http > 1.1.2.3.39465: Flags [.], seq 1:1449, ack 117, win 91, options [nop,nop,TS val 312531 ecr 312590], length 1448
