11:48:29.489579 IP 1.1.2.3.41608 > 5.6.7.8.http: Flags [S], seq 2070957098, win 5840, options [mss 1460,sackOK,TS val 578023 ecr 0,nop,wscale 6], length 0
11:48:29.489851 IP 5.6.7.8.http > 1.1.2.3.41608: Flags [S.], seq 2663272876, ack 2070957099, win 5792, options [mss 1460,sackOK,TS val 577966 ecr 578023,nop,wscale 6], length 0
11:48:29.489895 IP 1.1.2.3.41608 > 5.6.7.8.http: Flags [.], ack 1, win 92, options [nop,nop,TS val 578023 ecr 577966], length 0
11:48:29.489975 IP 1.1.2.3.41608 > 5.6.7.8.http: Flags [P.], seq 1:117, ack 1, win 92, options [nop,nop,TS val 578023 ecr 577966], length 116
11:48:29.490199 IP 5.6.7.8.http > 1.1.2.3.41608: Flags [.], ack 117, win 91, options [nop,nop,TS val 577966 ecr 578023], length 0
11:48:29.492795 IP 5.6.7.8.http > 1.1.2.3.41608: Flags [.], seq 1:1449, ack 117, win 91, options [nop,nop,TS val 577966 ecr 578023], length 1448
11:48:29.492806 IP 1.1.2.3.41608 > 5.6.7.8.http: Flags [.], ack 1449, win 137, options [nop,nop,TS val 578024 ecr 577966], length 0
11:48:29.492813 IP 5.6.7.8.http > 1.1.2.3.41608: Flags [P.], seq 1449:2124, ack 117, win 91, options [nop,nop,TS val 577966 ecr 578023], length 675
11:48:29.492819 IP 1.1.2.3.41608 > 5.6.7.8.http: Flags [.], ack 2124, win 182, options [nop,nop,TS val 578024 ecr 577966], length 0
11:48:29.493341 IP 1.1.2.3.41608 > 5.6.7.8.http: Flags [F.], seq 117, ack 2124, win 182, options [nop,nop,TS val 578024 ecr 577966], length 0
11:48:29.493595 IP 5.6.7.8.http > 1.1.2.3.41608: Flags [F.], seq 2124, ack 118, win 91, options [nop,nop,TS val 577967 ecr 578024], length 0
11:48:29.493620 IP 1.1.2.3.41608 > 5.6.7.8.http: Flags [.], ack 2125, win 182, options [nop,nop,TS val 578024 ecr 577967], length 0
11:48:31.026250 IP 1.1.2.3.41609 > 5.6.7.8.http: Flags [S], seq 4109726200, win 5840, options [mss 1460,sackOK,TS val 578407 ecr 0,nop,wscale 6], length 0
11:48:31.026543 IP 5.6.7.8.http > 1.1.2.3.41609: Flags [S.], seq 3918974622, ack 4109726201, win 5792, options [mss 1460,sackOK,TS val 578349 ecr 578407,nop,wscale 6], length 0
11:48:31.026577 IP 1.1.2.3.41609 > 5.6.7.8.http: Flags [.], ack 1, win 92, options [nop,nop,TS val 578407 ecr 578349], length 0
11:48:31.026628 IP 1.1.2.3.41609 > 5.6.7.8.http: Flags [P.], seq 1:117, ack 1, win 92, options [nop,nop,TS val 578407 ecr 578349], length 116
11:48:31.026790 IP 5.6.7.8.http > 1.1.2.3.41609: Flags [.], ack 117, win 91, options [nop,nop,TS val 578349 ecr 578407], length 0
11:48:31.029586 IP 5.6.7.8.http > 1.1.2.3.41609: Flags [.], seq 1:1449, ack 117, win 91, options [nop,nop,TS val 578350 ecr 578407], length 1448
11:48:31.029597 IP 1.1.2.3.41609 > 5.6.7.8.http: Flags [.], ack 1449, win 137, options [nop,nop,TS val 578408 ecr 578350], length 0
11:48:31.029604 IP 5.6.7.8.http > 1.1.2.3.41609: Flags [.], seq 1449:2897, ack 117, win 91, options [nop,nop,TS val 578350 ecr 578407], length 1448
11:48:31.029611 IP 1.1.2.3.41609 > 5.6.7.8.http: Flags [.], ack 2897, win 182, options [nop,nop,TS val 578408 ecr 578350], length 0
11:48:31.029615 IP 5.6.7.8.http > 1.1.2.3.41609: Flags [.], seq 2897:4345, ack 117, win 91, options [nop,nop,TS val 578350 ecr 578407], length 1448
11:48:31.029624 IP 1.1.2.3.41609 > 5.6.7.8.http: Flags [.], ack 4345, win 227, options [nop,nop,TS val 578408 ecr 578350], length 0
11:48:31.029836 IP 5.6.7.8.http > 1.1.2.3.41609: Flags [P.], seq 4345:4670, ack 117, win 91, options [nop,nop,TS val 578350 ecr 578408], length 325
11:48:31.029851 IP 1.1.2.3.41609 > 5.6.7.8.http: Flags [.], ack 4670, win 273, options [nop,nop,TS val 578408 ecr 578350], length 0
11:48:31.069892 IP 1.1.2.3.41609 > 5.6.7.8.http: Flags [F.], seq 117, ack 4670, win 273, options [nop,nop,TS val 578418 ecr 578350], length 0
11:48:31.070128 IP 5.6.7.8.http > 1.1.2.3.41609: Flags [F.], seq 4670, ack 118, win 91, options [nop,nop,TS val 578361 ecr 578418], length 0
11:48:31.070158 IP 1.1.2.3.41609 > 5.6.7.8.http: Flags [.], ack 4671, win 273, options [nop,nop,TS val 578418 ecr 578361], length 0
11:48:31.241491 IP 1.1.2.3.41610 > 5.6.7.8.http: Flags [S], seq 2464070070, win 5840, options [mss 1460,sackOK,TS val 578461 ecr 0,nop,wscale 6], length 0
11:48:31.241669 IP 5.6.7.8.http > 1.1.2.3.41610: Flags [S.], seq 3019314818, ack 2464070071, win 5792, options [mss 1460,sackOK,TS val 578404 ecr 578461,nop,wscale 6], length 0
11:48:31.241702 IP 1.1.2.3.41610 > 5.6.7.8.http: Flags [.], ack 1, win 92, options [nop,nop,TS val 578461 ecr 578404], length 0
11:48:31.241757 IP 1.1.2.3.41610 > 5.6.7.8.http: Flags [P.], seq 1:117, ack 1, win 92, options [nop,nop,TS val 578461 ecr 578404], length 116
11:48:31.241917 IP 5.6.7.8.http > 1.1.2.3.41610: Flags [.], ack 117, win 91, options [nop,nop,TS val 578404 ecr 578461], length 0
11:48:31.244863 IP 5.6.7.8.http > 1.1.2.3.41610: Flags [.], seq 1:1449, ack 117, win 91, options [nop,nop,TS val 578404 ecr 578461], length 1448
11:48:31.244874 IP 1.1.2.3.41610 > 5.6.7.8.http: Flags [.], ack 1449, win 137, options [nop,nop,TS val 578462 ecr 578404], length 0
11:48:31.244881 IP 5.6.7.8.http > 1.1.2.3.41610: Flags [.], seq 1449:2897, ack 117, win 91, options [nop,nop,TS val 578404 ecr 578461], length 1448
11:48:31.244888 IP 1.1.2.3.41610 > 5.6.7.8.http: Flags [.], ack 2897, win 182, options [nop,nop,TS val 578462 ecr 578404], length 0
11:48:31.244892 IP 5.6.7.8.http > 1.1.2.3.41610: Flags [.], seq 2897:4345, ack 117, win 91, options [nop,nop,TS val 578404 ecr 578461], length 1448
11:48:31.244900 IP 1.1.2.3.41610 > 5.6.7.8.http: Flags [.], ack 4345, win 227, options [nop,nop,TS val 578462 ecr 578404], length 0
11:48:31.245163 IP 5.6.7.8.http > 1.1.2.3.41610: Flags [.], seq 4345:5793, ack 117, win 91, options [nop,nop,TS val 578404 ecr 578462], length 1448
11:48:31.245177 IP 1.1.2.3.41610 > 5.6.7.8.http: Flags [.], ack 5793, win 273, options [nop,nop,TS val 578462 ecr 578404], length 0
11:48:31.245183 IP 5.6.7.8.http > 1.1.2.3.41610: Flags [P.], seq 5793:7241, ack 117, win 91, options [nop,nop,TS val 578404 ecr 578462], length 1448
11:48:31.245189 IP 1.1.2.3.41610 > 5.6.7.8.http: Flags [.], ack 7241, win 318, options [nop,nop,TS val 578462 ecr 578404], length 0
11:48:31.245194 IP 5.6.7.8.http > 1.1.2.3.41610: Flags [.], seq 7241:8689, ack 117, win 91, options [nop,nop,TS val 578404 ecr 578462], length 1448
11:48:31.245200 IP 1.1.2.3.41610 > 5.6.7.8.http: Flags [.], ack 8689, win 363, options [nop,nop,TS val 578462 ecr 578404], length 0
11:48:31.245204 IP 5.6.7.8.http > 1.1.2.3.41610: Flags [P.], seq 8689:9811, ack 117, win 91, options [nop,nop,TS val 578404 ecr 578462], length 1122
11:48:31.245211 IP 1.1.2.3.41610 > 5.6.7.8.http: Flags [.], ack 9811, win 408, options [nop,nop,TS val 578462 ecr 578404], length 0
11:48:31.245637 IP 1.1.2.3.41610 > 5.6.7.8.http: Flags [F.], seq 117, ack 9811, win 408, options [nop,nop,TS val 578462 ecr 578404], length 0
11:48:31.245862 IP 5.6.7.8.http > 1.1.2.3.41610: Flags [F.], seq 9811, ack 118, win 91, options [nop,nop,TS val 578404 ecr 578462], length 0
11:48:31.245884 IP 1.1.2.3.41610 > 5.6.7.8.http: Flags [.], ack 9812, win 408, options [nop,nop,TS val 578462 ecr 578404], length 0
11:48:31.264096 IP 1.1.2.3.41611 > 5.6.7.8.http: Flags [S], seq 3026476091, win 5840, options [mss 1460,sackOK,TS val 578467 ecr 0,nop,wscale 6], length 0
11:48:31.264285 IP 5.6.7.8.http > 1.1.2.3.41611: Flags [S.], seq 2485192720, ack 3026476092, win 5792, options [mss 1460,sackOK,TS val 578409 ecr 578467,nop,wscale 6], length 0
11:48:31.264318 IP 1.1.2.3.41611 > 5.6.7.8.http: Flags [.], ack 1, win 92, options [nop,nop,TS val 578467 ecr 578409], length 0
11:48:31.264375 IP 1.1.2.3.41611 > 5.6.7.8.http: Flags [P.], seq 1:117, ack 1, win 92, options [nop,nop,TS val 578467 ecr 578409], length 116
11:48:31.264533 IP 5.6.7.8.http > 1.1.2.3.41611: Flags [.], ack 117, win 91, options [nop,nop,TS val 578409 ecr 578467], length 0
11:48:31.267379 IP 5.6.7.8.http > 1.1.2.3.41611: Flags [.], seq 1:1449, ack 117, win 91, options [nop,nop,TS val 578410 ecr 578467], length 1448
11:48:31.267389 IP 1.1.2.3.41611 > 5.6.7.8.http: Flags [.], ack 1449, win 137, options [nop,nop,TS val 578467 ecr 578410], length 0
11:48:31.267397 IP 5.6.7.8.http > 1.1.2.3.41611: Flags [.], seq 1449:2897, ack 117, win 91, options [nop,nop,TS val 578410 ecr 578467], length 1448
11:48:31.267408 IP 1.1.2.3.41611 > 5.6.7.8.http: Flags [.], ack 2897, win 182, options [nop,nop,TS val 578467 ecr 578410], length 0
11:48:31.267414 IP 5.6.7.8.http > 1.1.2.3.41611: Flags [.], seq 2897:4345, ack 117, win 91, options [nop,nop,TS val 578410 ecr 578467], length 1448
11:48:31.267425 IP 1.1.2.3.41611 > 5.6.7.8.http: Flags [.], ack 4345, win 227, options [nop,nop,TS val 578467 ecr 578410], length 0
11:48:31.267628 IP 5.6.7.8.http > 1.1.2.3.41611: Flags [P.], seq 4345:4912, ack 117, win 91, options [nop,nop,TS val 578410 ecr 578467], length 567
11:48:31.267644 IP 1.1.2.3.41611 > 5.6.7.8.http: Flags [.], ack 4912, win 273, options [nop,nop,TS val 578468 ecr 578410], length 0
11:48:31.268078 IP 1.1.2.3.41611 > 5.6.7.8.http: Flags [F.], seq 117, ack 4912, win 273, options [nop,nop,TS val 578468 ecr 578410], length 0
11:48:31.268329 IP 5.6.7.8.http > 1.1.2.3.41611: Flags [F.], seq 4912, ack 118, win 91, options [nop,nop,TS val 578410 ecr 578468], length 0
11:48:31.268355 IP 1.1.2.3.41611 > 5.6.7.8.http: Flags [.], ack 4913, win 273, options [nop,nop,TS val 578468 ecr 578410], length 0
11:48:31.317823 IP 1.1.2.3.41612 > 5.6.7.8.http: Flags [S], seq 8689336, win 5840, options [mss 1460,sackOK,TS val 578480 ecr 0,nop,wscale 6], length 0
11:48:31.318054 IP 5.6.7.8.http > 1.1.2.3.41612: Flags [S.], seq 1944559053, ack 8689337, win 5792, options [mss 1460,sackOK,TS val 578423 ecr 578480,nop,wscale 6], length 0
11:48:31.318086 IP 1.1.2.3.41612 > 5.6.7.8.http: Flags [.], ack 1, win 92, options [nop,nop,TS val 578480 ecr 578423], length 0
11:48:31.318136 IP 1.1.2.3.41612 > 5.6.7.8.http: Flags [P.], seq 1:117, ack 1, win 92, options [nop,nop,TS val 578480 ecr 578423], length 116
11:48:31.318352 IP 5.6.7.8.http > 1.1.2.3.41612: Flags [.], ack 117, win 91, options [nop,nop,TS val 578423 ecr 578480], length 0
11:48:31.320898 IP 5.6.7.8.http > 1.1.2.3.41612: Flags [.], seq 1:1449, ack 117, win 91, options [nop,nop,TS val 578423 ecr 578480], length 1448
11:48:31.320909 IP 1.1.2.3.41612 > 5.6.7.8.http: Flags [.], ack 1449, win 137, options [nop,nop,TS val 578481 ecr 578423], length 0
11:48:31.320916 IP 5.6.7.8.http > 1.1.2.3.41612: Flags [.], seq 1449:2897, ack 117, win 91, options [nop,nop,TS val 578423 ecr 578480], length 1448
11:48:31.320922 IP 1.1.2.3.41612 > 5.6.7.8.http: Flags [.], ack 2897, win 182, options [nop,nop,TS val 578481 ecr 578423], length 0
11:48:31.320927 IP 5.6.7.8.http > 1.1.2.3.41612: Flags [P.], seq 2897:3486, ack 117, win 91, options [nop,nop,TS val 578423 ecr 578480], length 589
11:48:31.320935 IP 1.1.2.3.41612 > 5.6.7.8.http: Flags [.], ack 3486, win 227, options [nop,nop,TS val 578481 ecr 578423], length 0
11:48:31.321450 IP 1.1.2.3.41612 > 5.6.7.8.http: Flags [F.], seq 117, ack 3486, win 227, options [nop,nop,TS val 578481 ecr 578423], length 0
11:48:31.321698 IP 5.6.7.8.http > 1.1.2.3.41612: Flags [F.], seq 3486, ack 118, win 91, options [nop,nop,TS val 578424 ecr 578481], length 0
11:48:31.321721 IP 1.1.2.3.41612 > 5.6.7.8.http: Flags [.], ack 3487, win 227, options [nop,nop,TS val 578481 ecr 578424], length 0
11:48:31.369514 IP 1.1.2.3.41613 > 5.6.7.8.http: Flags [S], seq 2135184443, win 5840, options [mss 1460,sackOK,TS val 578493 ecr 0,nop,wscale 6], length 0
11:48:31.369727 IP 5.6.7.8.http > 1.1.2.3.41613: Flags [S.], seq 3724121958, ack 2135184444, win 5792, options [mss 1460,sackOK,TS val 578436 ecr 578493,nop,wscale 6], length 0
11:48:31.369758 IP 1.1.2.3.41613 > 5.6.7.8.http: Flags [.], ack 1, win 92, options [nop,nop,TS val 578493 ecr 578436], length 0
11:48:31.369809 IP 1.1.2.3.41613 > 5.6.7.8.http: Flags [P.], seq 1:117, ack 1, win 92, options [nop,nop,TS val 578493 ecr 578436], length 116
11:48:31.370024 IP 5.6.7.8.http > 1.1.2.3.41613: Flags [.], ack 117, win 91, options [nop,nop,TS val 578436 ecr 578493], length 0
11:48:31.372820 IP 5.6.7.8.http > 1.1.2.3.41613: Flags [.], seq 1:1449, ack 117, win 91, options [nop,nop,TS val 578436 ecr 578493], length 1448
11:48:31.372831 IP 1.1.2.3.41613 > 5.6.7.8.http: Flags [.], ack 1449, win 137, options [nop,nop,TS val 578494 ecr 578436], length 0
11:48:31.372838 IP 5.6.7.8.http > 1.1.2.3.41613: Flags [.], seq 1449:2897, ack 117, win 91, options [nop,nop,TS val 578436 ecr 578493], length 1448
11:48:31.372845 IP 1.1.2.3.41613 > 5.6.7.8.http: Flags [.], ack 2897, win 182, options [nop,nop,TS val 578494 ecr 578436], length 0
11:48:31.372849 IP 5.6.7.8.http > 1.1.2.3.41613: Flags [.], seq 2897:4345, ack 117, win 91, options [nop,nop,TS val 578436 ecr 578493], length 1448
11:48:31.372857 IP 1.1.2.3.41613 > 5.6.7.8.http: Flags [.], ack 4345, win 227, options [nop,nop,TS val 578494 ecr 578436], length 0
11:48:31.373070 IP 5.6.7.8.http > 1.1.2.3.41613: Flags [.], seq 4345:5793, ack 117, win 91, options [nop,nop,TS val 578436 ecr 578494], length 1448
11:48:31.373084 IP 1.1.2.3.41613 > 5.6.7.8.http: Flags [.], ack 5793, win 273, options [nop,nop,TS val 578494 ecr 578436], length 0
11:48:31.373090 IP 5.6.7.8.http > 1.1.2.3.41613: Flags [P.], seq 5793:5991, ack 117, win 91, options [nop,nop,TS val 578436 ecr 578494], length 198
11:48:31.373097 IP 1.1.2.3.41613 > 5.6.7.8.http: Flags [.], ack 5991, win 318, options [nop,nop,TS val 578494 ecr 578436], length 0
11:48:31.373523 IP 1.1.2.3.41613 > 5.6.7.8.http: Flags [F.], seq 117, ack 5991, win 318, options [nop,nop,TS val 578494 ecr 578436], length 0
11:48:31.373769 IP 5.6.7.8.http > 1.1.2.3.41613: Flags [F.], seq 5991, ack 118, win 91, options [nop,nop,TS val 578436 ecr 578494], length 0
11:48:31.373793 IP 1.1.2.3.41613 > 5.6.7.8.http: Flags [.], ack 5992, win 318, options [nop,nop,TS val 578494 ecr 578436], length 0
11:48:31.405119 IP 1.1.2.3.41614 > 5.6.7.8.http: Flags [S], seq 1015928205, win 5840, options [mss 1460,sackOK,TS val 578502 ecr 0,nop,wscale 6], length 0
11:48:31.405323 IP 5.6.7.8.http > 1.1.2.3.41614: Flags [S.], seq 3309647161, ack 1015928206, win 5792, options [mss 1460,sackOK,TS val 578444 ecr 578502,nop,wscale 6], length 0
11:48:31.405356 IP 1.1.2.3.41614 > 5.6.7.8.http: Flags [.], ack 1, win 92, options [nop,nop,TS val 578502 ecr 578444], length 0
11:48:31.405413 IP 1.1.2.3.41614 > 5.6.7.8.http: Flags [P.], seq 1:117, ack 1, win 92, options [nop,nop,TS val 578502 ecr 578444], length 116
11:48:31.405620 IP 5.6.7.8.http > 1.1.2.3.41614: Flags [.], ack 117, win 91, options [nop,nop,TS val 578444 ecr 578502], length 0
11:48:31.408316 IP 5.6.7.8.http > 1.1.2.3.41614: Flags [.], seq 1:1449, ack 117, win 91, options [nop,nop,TS val 578445 ecr 578502], length 1448
11:48:31.408328 IP 1.1.2.3.41614 > 5.6.7.8.http: Flags [.], ack 1449, win 137, options [nop,nop,TS val 578503 ecr 578445], length 0
11:48:31.408335 IP 5.6.7.8.http > 1.1.2.3.41614: Flags [.], seq 1449:2897, ack 117, win 91, options [nop,nop,TS val 578445 ecr 578502], length 1448
11:48:31.408341 IP 1.1.2.3.41614 > 5.6.7.8.http: Flags [.], ack 2897, win 182, options [nop,nop,TS val 578503 ecr 578445], length 0
11:48:31.408345 IP 5.6.7.8.http > 1.1.2.3.41614: Flags [.], seq 2897:4345, ack 117, win 91, options [nop,nop,TS val 578445 ecr 578502], length 1448
11:48:31.408353 IP 1.1.2.3.41614 > 5.6.7.8.http: Flags [.], ack 4345, win 227, options [nop,nop,TS val 578503 ecr 578445], length 0
11:48:31.408566 IP 5.6.7.8.http > 1.1.2.3.41614: Flags [P.], seq 4345:4945, ack 117, win 91, options [nop,nop,TS val 578445 ecr 578503], length 600
11:48:31.408581 IP 1.1.2.3.41614 > 5.6.7.8.http: Flags [.], ack 4945, win 273, options [nop,nop,TS val 578503 ecr 578445], length 0
11:48:31.409000 IP 1.1.2.3.41614 > 5.6.7.8.http: Flags [F.], seq 117, ack 4945, win 273, options [nop,nop,TS val 578503 ecr 578445], length 0
11:48:31.409266 IP 5.6.7.8.http > 1.1.2.3.41614: Flags [F.], seq 4945, ack 118, win 91, options [nop,nop,TS val 578445 ecr 578503], length 0
11:48:31.409289 IP 1.1.2.3.41614 > 5.6.7.8.http: Flags [.], ack 4946, win 273, options [nop,nop,TS val 578503 ecr 578445], length 0
11:48:31.429345 IP 1.1.2.3.41615 > 5.6.7.8.http: Flags [S], seq 4111536337, win 5840, options [mss 1460,sackOK,TS val 578508 ecr 0,nop,wscale 6], length 0
11:48:31.429587 IP 5.6.7.8.http > 1.1.2.3.41615: Flags [S.], seq 2132251887, ack 4111536338, win 5792, options [mss 1460,sackOK,TS val 578450 ecr 578508,nop,wscale 6], length 0
11:48:31.429619 IP 1.1.2.3.41615 > 5.6.7.8.http: Flags [.], ack 1, win 92, options [nop,nop,TS val 578508 ecr 578450], length 0
11:48:31.429669 IP 1.1.2.3.41615 > 5.6.7.8.http: Flags [P.], seq 1:117, ack 1, win 92, options [nop,nop,TS val 578508 ecr 578450], length 116
11:48:31.429885 IP 5.6.7.8.http > 1.1.2.3.41615: Flags [.], ack 117, win 91, options [nop,nop,TS val 578450 ecr 578508], length 0
11:48:31.432380 IP 5.6.7.8.http > 1.1.2.3.41615: Flags [.], seq 1:1449, ack 117, win 91, options [nop,nop,TS val 578451 ecr 578508], length 1448
11:48:31.432392 IP 1.1.2.3.41615 > 5.6.7.8.http: Flags [.], ack 1449, win 137, options [nop,nop,TS val 578509 ecr 578451], length 0
11:48:31.432399 IP 5.6.7.8.http > 1.1.2.3.41615: Flags [P.], seq 1449:2360, ack 117, win 91, options [nop,nop,TS val 578451 ecr 578508], length 911
11:48:31.432406 IP 1.1.2.3.41615 > 5.6.7.8.http: Flags [.], ack 2360, win 182, options [nop,nop,TS val 578509 ecr 578451], length 0
11:48:31.432904 IP 1.1.2.3.41615 > 5.6.7.8.http: Flags [F.], seq 117, ack 2360, win 182, options [nop,nop,TS val 578509 ecr 578451], length 0
11:48:31.433180 IP 5.6.7.8.http > 1.1.2.3.41615: Flags [F.], seq 2360, ack 118, win 91, options [nop,nop,TS val 578451 ecr 578509], length 0
11:48:31.433204 IP 1.1.2.3.41615 > 5.6.7.8.http: Flags [.], ack 2361, win 182, options [nop,nop,TS val 578509 ecr 578451], length 0
11:48:31.453772 IP 1.1.2.3.41616 > 5.6.7.8.http: Flags [S], seq 19112278, win 5840, options [mss 1460,sackOK,TS val 578514 ecr 0,nop,wscale 6], length 0
11:48:31.454000 IP 5.6.7.8.http > 1.1.2.3.41616: Flags [S.], seq 2055924226, ack 19112279, win 5792, options [mss 1460,sackOK,TS val 578456 ecr 578514,nop,wscale 6], length 0
11:48:31.454033 IP 1.1.2.3.41616 > 5.6.7.8.http: Flags [.], ack 1, win 92, options [nop,nop,TS val 578514 ecr 578456], length 0
11:48:31.454090 IP 1.1.2.3.41616 > 5.6.7.8.http: Flags [P.], seq 1:117, ack 1, win 92, options [nop,nop,TS val 578514 ecr 578456], length 116
11:48:31.454297 IP 5.6.7.8.http > 1.1.2.3.41616: Flags [.], ack 117, win 91, options [nop,nop,TS val 578456 ecr 578514], length 0
11:48:31.456743 IP 5.6.7.8.http > 1.1.2.3.41616: Flags [.], seq 1:1449, ack 117, win 91, options [nop,nop,TS val 578457 ecr 578514], length 1448
11:48:31.456754 IP 1.1.2.3.41616 > 5.6.7.8.http: Flags [.], ack 1449, win 137, options [nop,nop,TS val 578515 ecr 578457], length 0
11:48:31.456761 IP 5.6.7.8.http > 1.1.2.3.41616: Flags [P.], seq 1449:1942, ack 117, win 91, options [nop,nop,TS val 578457 ecr 578514], length 493
11:48:31.456768 IP 1.1.2.3.41616 > 5.6.7.8.http: Flags [.], ack 1942, win 182, options [nop,nop,TS val 578515 ecr 578457], length 0
11:48:31.457274 IP 1.1.2.3.41616 > 5.6.7.8.http: Flags [F.], seq 117, ack 1942, win 182, options [nop,nop,TS val 578515 ecr 578457], length 0
11:48:31.457544 IP 5.6.7.8.http > 1.1.2.3.41616: Flags [F.], seq 1942, ack 118, win 91, options [nop,nop,TS val 578457 ecr 578515], length 0
11:48:31.457569 IP 1.1.2.3.41616 > 5.6.7.8.http: Flags [.], ack 1943, win 182, options [nop,nop,TS val 578515 ecr 578457], length 0
11:48:31.471405 IP 1.1.2.3.41617 > 5.6.7.8.http: Flags [S], seq 1833452261, win 5840, options [mss 1460,sackOK,TS val 578518 ecr 0,nop,wscale 6], length 0
11:48:31.471623 IP 5.6.7.8.http > 1.1.2.3.41617: Flags [S.], seq 1681392072, ack 1833452262, win 5792, options [mss 1460,sackOK,TS val 578461 ecr 578518,nop,wscale 6], length 0
11:48:31.471656 IP 1.1.2.3.41617 > 5.6.7.8.http: Flags [.], ack 1, win 92, options [nop,nop,TS val 578519 ecr 578461], length 0
11:48:31.471714 IP 1.1.2.3.41617 > 5.6.7.8.http: Flags [P.], seq 1:117, ack 1, win 92, options [nop,nop,TS val 578519 ecr 578461], length 116
11:48:31.471921 IP 5.6.7.8.http > 1.1.2.3.41617: Flags [.], ack 117, win 91, options [nop,nop,TS val 578461 ecr 578519], length 0
11:48:31.474417 IP 5.6.7.8.http > 1.1.2.3.41617: Flags [.], seq 1:1449, ack 117, win 91, options [nop,nop,TS val 578462 ecr 578519], length 1448
11:48:31.474428 IP 1.1.2.3.41617 > 5.6.7.8.http: Flags [.], ack 1449, win 137, options [nop,nop,TS val 578519 ecr 578462], length 0
11:48:31.474435 IP 5.6.7.8.http > 1.1.2.3.41617: Flags [P.], seq 1449:2447, ack 117, win 91, options [nop,nop,TS val 578462 ecr 578519], length 998
11:48:31.474441 IP 1.1.2.3.41617 > 5.6.7.8.http: Flags [.], ack 2447, win 182, options [nop,nop,TS val 578519 ecr 578462], length 0
11:48:31.474950 IP 1.1.2.3.41617 > 5.6.7.8.http: Flags [F.], seq 117, ack 2447, win 182, options [nop,nop,TS val 578519 ecr 578462], length 0
11:48:31.475217 IP 5.6.7.8.http > 1.1.2.3.41617: Flags [F.], seq 2447, ack 118, win 91, options [nop,nop,TS val 578462 ecr 578519], length 0
11:48:31.475243 IP 1.1.2.3.41617 > 5.6.7.8.http: Flags [.], ack 2448, win 182, options [nop,nop,TS val 578519 ecr 578462], length 0
11:48:31.488772 IP 1.1.2.3.41618 > 5.6.7.8.http: Flags [S], seq 2223328037, win 5840, options [mss 1460,sackOK,TS val 578523 ecr 0,nop,wscale 6], length 0
11:48:31.488997 IP 5.6.7.8.http > 1.1.2.3.41618: Flags [S.], seq 1363578498, ack 2223328038, win 5792, options [mss 1460,sackOK,TS val 578465 ecr 578523,nop,wscale 6], length 0
11:48:31.489029 IP 1.1.2.3.41618 > 5.6.7.8.http: Flags [.], ack 1, win 92, options [nop,nop,TS val 578523 ecr 578465], length 0
11:48:31.489086 IP 1.1.2.3.41618 > 5.6.7.8.http: Flags [P.], seq 1:117, ack 1, win 92, options [nop,nop,TS val 578523 ecr 578465], length 116
11:48:31.489295 IP 5.6.7.8.http > 1.1.2.3.41618: Flags [.], ack 117, win 91, options [nop,nop,TS val 578465 ecr 578523], length 0
11:48:31.492140 IP 5.6.7.8.http > 1.1.2.3.41618: Flags [.], seq 1:1449, ack 117, win 91, options [nop,nop,TS val 578466 ecr 578523], length 1448
11:48:31.492152 IP 1.1.2.3.41618 > 5.6.7.8.http: Flags [.], ack 1449, win 137, options [nop,nop,TS val 578524 ecr 578466], length 0
11:48:31.492190 IP 5.6.7.8.http > 1.1.2.3.41618: Flags [.], seq 1449:2897, ack 117, win 91, options [nop,nop,TS val 578466 ecr 578523], length 1448
11:48:31.492204 IP 1.1.2.3.41618 > 5.6.7.8.http: Flags [.], ack 2897, win 182, options [nop,nop,TS val 578524 ecr 578466], length 0
11:48:31.492208 IP 5.6.7.8.http > 1.1.2.3.41618: Flags [.], seq 2897:4345, ack 117, win 91, options [nop,nop,TS val 578466 ecr 578523], length 1448
11:48:31.492219 IP 1.1.2.3.41618 > 5.6.7.8.http: Flags [.], ack 4345, win 227, options [nop,nop,TS val 578524 ecr 578466], length 0
11:48:31.492390 IP 5.6.7.8.http > 1.1.2.3.41618: Flags [.], seq 4345:5793, ack 117, win 91, options [nop,nop,TS val 578466 ecr 578524], length 1448
11:48:31.492405 IP 1.1.2.3.41618 > 5.6.7.8.http: Flags [.], ack 5793, win 273, options [nop,nop,TS val 578524 ecr 578466], length 0
11:48:31.492411 IP 5.6.7.8.http > 1.1.2.3.41618: Flags [P.], seq 5793:6926, ack 117, win 91, options [nop,nop,TS val 578466 ecr 578524], length 1133
11:48:31.492418 IP 1.1.2.3.41618 > 5.6.7.8.http: Flags [.], ack 6926, win 318, options [nop,nop,TS val 578524 ecr 578466], length 0
11:48:31.492847 IP 1.1.2.3.41618 > 5.6.7.8.http: Flags [F.], seq 117, ack 6926, win 318, options [nop,nop,TS val 578524 ecr 578466], length 0
11:48:31.493090 IP 5.6.7.8.http > 1.1.2.3.41618: Flags [F.], seq 6926, ack 118, win 91, options [nop,nop,TS val 578466 ecr 578524], length 0
11:48:31.493115 IP 1.1.2.3.41618 > 5.6.7.8.http: Flags [.], ack 6927, win 318, options [nop,nop,TS val 578524 ecr 578466], length 0
11:48:31.632718 IP 1.1.2.3.41619 > 5.6.7.8.http: Flags [S], seq 933091711, win 5840, options [mss 1460,sackOK,TS val 578559 ecr 0,nop,wscale 6], length 0
11:48:31.632932 IP 5.6.7.8.http > 1.1.2.3.41619: Flags [S.], seq 2566727029, ack 933091712, win 5792, options [mss 1460,sackOK,TS val 578501 ecr 578559,nop,wscale 6], length 0
11:48:31.632965 IP 1.1.2.3.41619 > 5.6.7.8.http: Flags [.], ack 1, win 92, options [nop,nop,TS val 578559 ecr 578501], length 0
11:48:31.633014 IP 1.1.2.3.41619 > 5.6.7.8.http: Flags [P.], seq 1:117, ack 1, win 92, options [nop,nop,TS val 578559 ecr 578501], length 116
11:48:31.633228 IP 5.6.7.8.http > 1.1.2.3.41619: Flags [.], ack 117, win 91, options [nop,nop,TS val 578501 ecr 578559], length 0
11:48:31.635774 IP 5.6.7.8.http > 1.1.2.3.41619: Flags [.], seq 1:1449, ack 117, win 91, options [nop,nop,TS val 578502 ecr 578559], length 1448
11:48:31.635785 IP 1.1.2.3.41619 > 5.6.7.8.http: Flags [.], ack 1449, win 137, options [nop,nop,TS val 578560 ecr 578502], length 0
11:48:31.635792 IP 5.6.7.8.http > 1.1.2.3.41619: Flags [P.], seq 1449:2588, ack 117, win 91, options [nop,nop,TS val 578502 ecr 578559], length 1139
11:48:31.635799 IP 1.1.2.3.41619 > 5.6.7.8.http: Flags [.], ack 2588, win 182, options [nop,nop,TS val 578560 ecr 578502], length 0
11:48:31.636315 IP 1.1.2.3.41619 > 5.6.7.8.http: Flags [F.], seq 117, ack 2588, win 182, options [nop,nop,TS val 578560 ecr 578502], length 0
11:48:31.636575 IP 5.6.7.8.http > 1.1.2.3.41619: Flags [F.], seq 2588, ack 118, win 91, options [nop,nop,TS val 578502 ecr 578560], length 0
11:48:31.636599 IP 1.1.2.3.41619 > 5.6.7.8.http: Flags [.], ack 2589, win 182, options [nop,nop,TS val 578560 ecr 578502], length 0
11:48:32.021204 IP 1.1.2.3.41620 > 5.6.7.8.http: Flags [S], seq 632425271, win 5840, options [mss 1460,sackOK,TS val 578656 ecr 0,nop,wscale 6], length 0
11:48:32.021497 IP 5.6.7.8.http > 1.1.2.3.41620: Flags [S.], seq 3992977619, ack 632425272, win 5792, options [mss 1460,sackOK,TS val 578598 ecr 578656,nop,wscale 6], length 0
11:48:32.021529 IP 1.1.2.3.41620 > 5.6.7.8.http: Flags [.], ack 1, win 92, options [nop,nop,TS val 578656 ecr 578598], length 0
11:48:32.021600 IP 1.1.2.3.41620 > 5.6.7.8.http: Flags [P.], seq 1:117, ack 1, win 92, options [nop,nop,TS val 578656 ecr 578598], length 116
11:48:32.021794 IP 5.6.7.8.http > 1.1.2.3.41620: Flags [.], ack 117, win 91, options [nop,nop,TS val 578598 ecr 578656], length 0
11:48:32.024440 IP 5.6.7.8.http > 1.1.2.3.41620: Flags [.], seq 1:1449, ack 117, win 91, options [nop,nop,TS val 578599 ecr 578656], length 1448
11:48:32.024451 IP 1.1.2.3.41620 > 5.6.7.8.http: Flags [.], ack 1449, win 137, options [nop,nop,TS val 578657 ecr 578599], length 0
11:48:32.024458 IP 5.6.7.8.http > 1.1.2.3.41620: Flags [.], seq 1449:2897, ack 117, win 91, options [nop,nop,TS val 578599 ecr 578656], length 1448
11:48:32.024465 IP 1.1.2.3.41620 > 5.6.7.8.http: Flags [.], ack 2897, win 182, options [nop,nop,TS val 578657 ecr 578599], length 0
11:48:32.024469 IP 5.6.7.8.http > 1.1.2.3.41620: Flags [P.], seq 2897:3357, ack 117, win 91, options [nop,nop,TS val 578599 ecr 578656], length 460
11:48:32.024478 IP 1.1.2.3.41620 > 5.6.7.8.http: Flags [.], ack 3357, win 227, options [nop,nop,TS val 578657 ecr 578599], length 0
11:48:32.024994 IP 1.1.2.3.41620 > 5.6.7.8.http: Flags [F.], seq 117, ack 3357, win 227, options [nop,nop,TS val 578657 ecr 578599], length 0
11:48:32.025240 IP 5.6.7.8.http > 1.1.2.3.41620: Flags [F.], seq 3357, ack 118, win 91, options [nop,nop,TS val 578599 ecr 578657], length 0
11:48:32.025264 IP 1.1.2.3.41620 > 5.6.7.8.http: Flags [.], ack 3358, win 227, options [nop,nop,TS val 578657 ecr 578599], length 0
11:48:32.368681 IP 1.1.2.3.41621 > 5.6.7.8.http: Flags [S], seq 582348972, win 5840, options [mss 1460,sackOK,TS val 578743 ecr 0,nop,wscale 6], length 0
11:48:32.368924 IP 5.6.7.8.http > 1.1.2.3.41621: Flags [S.], seq 891681754, ack 582348973, win 5792, options [mss 1460,sackOK,TS val 578685 ecr 578743,nop,wscale 6], length 0
11:48:32.368957 IP 1.1.2.3.41621 > 5.6.7.8.http: Flags [.], ack 1, win 92, options [nop,nop,TS val 578743 ecr 578685], length 0
11:48:32.369015 IP 1.1.2.3.41621 > 5.6.7.8.http: Flags [P.], seq 1:117, ack 1, win 92, options [nop,nop,TS val 578743 ecr 578685], length 116
11:48:32.369223 IP 5.6.7.8.http > 1.1.2.3.41621: Flags [.], ack 117, win 91, options [nop,nop,TS val 578685 ecr 578743], length 0
11:48:32.371867 IP 5.6.7.8.http > 1.1.2.3.41621: Flags [.], seq 1:1449, ack 117, win 91, options [nop,nop,TS val 578686 ecr 578743], length 1448
11:48:32.371879 IP 1.1.2.3.41621 > 5.6.7.8.http: Flags [.], ack 1449, win 137, options [nop,nop,TS val 578744 ecr 578686], length 0
11:48:32.371886 IP 5.6.7.8.http > 1.1.2.3.41621: Flags [.], seq 1449:2897, ack 117, win 91, options [nop,nop,TS val 578686 ecr 578743], length 1448
11:48:32.371892 IP 1.1.2.3.41621 > 5.6.7.8.http: Flags [.], ack 2897, win 182, options [nop,nop,TS val 578744 ecr 578686], length 0
11:48:32.371896 IP 5.6.7.8.http > 1.1.2.3.41621: Flags [P.], seq 2897:3929, ack 117, win 91, options [nop,nop,TS val 578686 ecr 578743], length 1032
11:48:32.371905 IP 1.1.2.3.41621 > 5.6.7.8.http: Flags [.], ack 3929, win 227, options [nop,nop,TS val 578744 ecr 578686], length 0
11:48:32.372423 IP 1.1.2.3.41621 > 5.6.7.8.http: Flags [F.], seq 117, ack 3929, win 227, options [nop,nop,TS val 578744 ecr 578686], length 0
11:48:32.372668 IP 5.6.7.8.http > 1.1.2.3.41621: Flags [F.], seq 3929, ack 118, win 91, options [nop,nop,TS val 578686 ecr 578744], length 0
11:48:32.372693 IP 1.1.2.3.41621 > 5.6.7.8.http: Flags [.], ack 3930, win 227, options [nop,nop,TS val 578744 ecr 578686], length 0
11:48:32.455891 IP 1.1.2.3.41622 > 5.6.7.8.http: Flags [S], seq 4018256086, win 5840, options [mss 1460,sackOK,TS val 578765 ecr 0,nop,wscale 6], length 0
11:48:32.456093 IP 5.6.7.8.http > 1.1.2.3.41622: Flags [S.], seq 2517712401, ack 4018256087, win 5792, options [mss 1460,sackOK,TS val 578707 ecr 578765,nop,wscale 6], length 0
11:48:32.456125 IP 1.1.2.3.41622 > 5.6.7.8.http: Flags [.], ack 1, win 92, options [nop,nop,TS val 578765 ecr 578707], length 0
11:48:32.456177 IP 1.1.2.3.41622 > 5.6.7.8.http: Flags [P.], seq 1:117, ack 1, win 92, options [nop,nop,TS val 578765 ecr 578707], length 116
11:48:32.456390 IP 5.6.7.8.http > 1.1.2.3.41622: Flags [.], ack 117, win 91, options [nop,nop,TS val 578707 ecr 578765], length 0
11:48:32.458986 IP 5.6.7.8.http > 1.1.2.3.41622: Flags [.], seq 1:1449, ack 117, win 91, options [nop,nop,TS val 578708 ecr 578765], length 1448
11:48:32.458997 IP 1.1.2.3.41622 > 5.6.7.8.http: Flags [.], ack 1449, win 137, options [nop,nop,TS val 578766 ecr 578708], length 0
11:48:32.459003 IP 5.6.7.8.http > 1.1.2.3.41622: Flags [.], seq 1449:2897, ack 117, win 91, options [nop,nop,TS val 578708 ecr 578765], length 1448
11:48:32.459010 IP 1.1.2.3.41622 > 5.6.7.8.http: Flags [.], ack 2897, win 182, options [nop,nop,TS val 578766 ecr 578708], length 0
11:48:32.459037 IP 5.6.7.8.http > 1.1.2.3.41622: Flags [P.], seq 2897:4059, ack 117, win 91, options [nop,nop,TS val 578708 ecr 578765], length 1162
11:48:32.459051 IP 1.1.2.3.41622 > 5.6.7.8.http: Flags [.], ack 4059, win 227, options [nop,nop,TS val 578766 ecr 578708], length 0
11:48:32.459562 IP 1.1.2.3.41622 > 5.6.7.8.http: Flags [F.], seq 117, ack 4059, win 227, options [nop,nop,TS val 578766 ecr 578708], length 0
11:48:32.459836 IP 5.6.7.8.http > 1.1.2.3.41622: Flags [F.], seq 4059, ack 118, win 91, options [nop,nop,TS val 578708 ecr 578766], length 0
11:48:32.459860 IP 1.1.2.3.41622 > 5.6.7.8.http: Flags [.], ack 4060, win 227, options [nop,nop,TS val 578766 ecr 578708], length 0
11:48:32.591664 IP 1.1.2.3.41623 > 5.6.7.8.http: Flags [S], seq 2345657197, win 5840, options [mss 1460,sackOK,TS val 578799 ecr 0,nop,wscale 6], length 0
11:48:32.591939 IP 5.6.7.8.http > 1.1.2.3.41623: Flags [S.], seq 3710825915, ack 2345657198, win 5792, options [mss 1460,sackOK,TS val 578741 ecr 578799,nop,wscale 6], length 0
11:48:32.591983 IP 1.1.2.3.41623 > 5.6.7.8.http: Flags [.], ack 1, win 92, options [nop,nop,TS val 578799 ecr 578741], length 0
11:48:32.592043 IP 1.1.2.3.41623 > 5.6.7.8.http: Flags [P.], seq 1:117, ack 1, win 92, options [nop,nop,TS val 578799 ecr 578741], length 116
11:48:32.592236 IP 5.6.7.8.http > 1.1.2.3.41623: Flags [.], ack 117, win 91, options [nop,nop,TS val 578741 ecr 578799], length 0
11:48:32.595131 IP 5.6.7.8.http > 1.1.2.3.41623: Flags [.], seq 1:1449, ack 117, win 91, options [nop,nop,TS val 578742 ecr 578799], length 1448
11:48:32.595143 IP 1.1.2.3.41623 > 5.6.7.8.http: Flags [.], ack 1449, win 137, options [nop,nop,TS val 578799 ecr 578742], length 0
11:48:32.595150 IP 5.6.7.8.http > 1.1.2.3.41623: Flags [.], seq 1449:2897, ack 117, win 91, options [nop,nop,TS val 578742 ecr 578799], length 1448
11:48:32.595156 IP 1.1.2.3.41623 > 5.6.7.8.http: Flags [.], ack 2897, win 182, options [nop,nop,TS val 578799 ecr 578742], length 0
11:48:32.595182 IP 5.6.7.8.http > 1.1.2.3.41623: Flags [.], seq 2897:4345, ack 117, win 91, options [nop,nop,TS val 578742 ecr 578799], length 1448
11:48:32.595196 IP 1.1.2.3.41623 > 5.6.7.8.http: Flags [.], ack 4345, win 227, options [nop,nop,TS val 578799 ecr 578742], length 0
11:48:32.595381 IP 5.6.7.8.http > 1.1.2.3.41623: Flags [.], seq 4345:5793, ack 117, win 91, options [nop,nop,TS val 578742 ecr 578799], length 1448
11:48:32.595396 IP 1.1.2.3.41623 > 5.6.7.8.http: Flags [.], ack 5793, win 273, options [nop,nop,TS val 578799 ecr 578742], length 0
11:48:32.595403 IP 5.6.7.8.http > 1.1.2.3.41623: Flags [P.], seq 5793:7241, ack 117, win 91, options [nop,nop,TS val 578742 ecr 578799], length 1448
11:48:32.595410 IP 1.1.2.3.41623 > 5.6.7.8.http: Flags [.], ack 7241, win 318, options [nop,nop,TS val 578799 ecr 578742], length 0
11:48:32.595432 IP 5.6.7.8.http > 1.1.2.3.41623: Flags [.], seq 7241:8689, ack 117, win 91, options [nop,nop,TS val 578742 ecr 578799], length 1448
11:48:32.595438 IP 1.1.2.3.41623 > 5.6.7.8.http: Flags [.], ack 8689, win 363, options [nop,nop,TS val 578799 ecr 578742], length 0
11:48:32.595442 IP 5.6.7.8.http > 1.1.2.3.41623: Flags [P.], seq 8689:9894, ack 117, win 91, options [nop,nop,TS val 578742 ecr 578799], length 1205
11:48:32.595448 IP 1.1.2.3.41623 > 5.6.7.8.http: Flags [.], ack 9894, win 408, options [nop,nop,TS val 578799 ecr 578742], length 0
11:48:32.595872 IP 1.1.2.3.41623 > 5.6.7.8.http: Flags [F.], seq 117, ack 9894, win 408, options [nop,nop,TS val 578800 ecr 578742], length 0
11:48:32.596132 IP 5.6.7.8.http > 1.1.2.3.41623: Flags [F.], seq 9894, ack 118, win 91, options [nop,nop,TS val 578742 ecr 578800], length 0
11:48:32.596157 IP 1.1.2.3.41623 > 5.6.7.8.http: Flags [.], ack 9895, win 408, options [nop,nop,TS val 578800 ecr 578742], length 0
11:48:32.897628 IP 1.1.2.3.41624 > 5.6.7.8.http: Flags [S], seq 2189454310, win 5840, options [mss 1460,sackOK,TS val 578875 ecr 0,nop,wscale 6], length 0
11:48:32.897880 IP 5.6.7.8.http > 1.1.2.3.41624: Flags [S.], seq 411650564, ack 2189454311, win 5792, options [mss 1460,sackOK,TS val 578818 ecr 578875,nop,wscale 6], length 0
11:48:32.897914 IP 1.1.2.3.41624 > 5.6.7.8.http: Flags [.], ack 1, win 92, options [nop,nop,TS val 578875 ecr 578818], length 0
11:48:32.897964 IP 1.1.2.3.41624 > 5.6.7.8.http: Flags [P.], seq 1:117, ack 1, win 92, options [nop,nop,TS val 578875 ecr 578818], length 116
11:48:32.898176 IP 5.6.7.8.http > 1.1.2.3.41624: Flags [.], ack 117, win 91, options [nop,nop,TS val 578818 ecr 578875], length 0
11:48:32.901121 IP 5.6.7.8.http > 1.1.2.3.41624: Flags [.], seq 1:1449, ack 117, win 91, options [nop,nop,TS val 578818 ecr 578875], length 1448
11:48:32.901132 IP 1.1.2.3.41624 > 5.6.7.8.http: Flags [.], ack 1449, win 137, options [nop,nop,TS val 578876 ecr 578818], length 0
11:48:32.901139 IP 5.6.7.8.http > 1.1.2.3.41624: Flags [.], seq 1449:2897, ack 117, win 91, options [nop,nop,TS val 578818 ecr 578875], length 1448
11:48:32.901146 IP 1.1.2.3.41624 > 5.6.7.8.http: Flags [.], ack 2897, win 182, options [nop,nop,TS val 578876 ecr 578818], length 0
11:48:32.901151 IP 5.6.7.8.http > 1.1.2.3.41624: Flags [.], seq 2897:4345, ack 117, win 91, options [nop,nop,TS val 578818 ecr 578875], length 1448
11:48:32.901159 IP 1.1.2.3.41624 > 5.6.7.8.http: Flags [.], ack 4345, win 227, options [nop,nop,TS val 578876 ecr 578818], length 0
11:48:32.901421 IP 5.6.7.8.http > 1.1.2.3.41624: Flags [.], seq 4345:5793, ack 117, win 91, options [nop,nop,TS val 578818 ecr 578876], length 1448
11:48:32.901435 IP 1.1.2.3.41624 > 5.6.7.8.http: Flags [.], ack 5793, win 273, options [nop,nop,TS val 578876 ecr 578818], length 0
11:48:32.901441 IP 5.6.7.8.http > 1.1.2.3.41624: Flags [P.], seq 5793:7241, ack 117, win 91, options [nop,nop,TS val 578818 ecr 578876], length 1448
11:48:32.901448 IP 1.1.2.3.41624 > 5.6.7.8.http: Flags [.], ack 7241, win 318, options [nop,nop,TS val 578876 ecr 578818], length 0
11:48:32.901452 IP 5.6.7.8.http > 1.1.2.3.41624: Flags [.], seq 7241:8689, ack 117, win 91, options [nop,nop,TS val 578818 ecr 578876], length 1448
11:48:32.901458 IP 1.1.2.3.41624 > 5.6.7.8.http: Flags [.], ack 8689, win 363, options [nop,nop,TS val 578876 ecr 578818], length 0
11:48:32.901462 IP 5.6.7.8.http > 1.1.2.3.41624: Flags [P.], seq 8689:10060, ack 117, win 91, options [nop,nop,TS val 578818 ecr 578876], length 1371
11:48:32.901468 IP 1.1.2.3.41624 > 5.6.7.8.http: Flags [.], ack 10060, win 408, options [nop,nop,TS val 578876 ecr 578818], length 0
11:48:32.901895 IP 1.1.2.3.41624 > 5.6.7.8.http: Flags [F.], seq 117, ack 10060, win 408, options [nop,nop,TS val 578876 ecr 578818], length 0
11:48:32.902121 IP 5.6.7.8.http > 1.1.2.3.41624: Flags [F.], seq 10060, ack 118, win 91, options [nop,nop,TS val 578818 ecr 578876], length 0
11:48:32.902144 IP 1.1.2.3.41624 > 5.6.7.8.http: Flags [.], ack 10061, win 408, options [nop,nop,TS val 578876 ecr 578818], length 0
11:48:33.178100 IP 1.1.2.3.41625 > 5.6.7.8.http: Flags [S], seq 868179955, win 5840, options [mss 1460,sackOK,TS val 578945 ecr 0,nop,wscale 6], length 0
11:48:33.178357 IP 5.6.7.8.http > 1.1.2.3.41625: Flags [S.], seq 62212104, ack 868179956, win 5792, options [mss 1460,sackOK,TS val 578888 ecr 578945,nop,wscale 6], length 0
11:48:33.178391 IP 1.1.2.3.41625 > 5.6.7.8.http: Flags [.], ack 1, win 92, options [nop,nop,TS val 578945 ecr 578888], length 0
11:48:33.178442 IP 1.1.2.3.41625 > 5.6.7.8.http: Flags [P.], seq 1:117, ack 1, win 92, options [nop,nop,TS val 578945 ecr 578888], length 116
11:48:33.178603 IP 5.6.7.8.http > 1.1.2.3.41625: Flags [.], ack 117, win 91, options [nop,nop,TS val 578888 ecr 578945], length 0
11:48:33.181100 IP 5.6.7.8.http > 1.1.2.3.41625: Flags [P.], seq 1:1303, ack 117, win 91, options [nop,nop,TS val 578888 ecr 578945], length 1302
11:48:33.181111 IP 1.1.2.3.41625 > 5.6.7.8.http: Flags [.], ack 1303, win 132, options [nop,nop,TS val 578946 ecr 578888], length 0
11:48:33.181633 IP 1.1.2.3.41625 > 5.6.7.8.http: Flags [F.], seq 117, ack 1303, win 132, options [nop,nop,TS val 578946 ecr 578888], length 0
11:48:33.181900 IP 5.6.7.8.http > 1.1.2.3.41625: Flags [F.], seq 1303, ack 118, win 91, options [nop,nop,TS val 578889 ecr 578946], length 0
11:48:33.181925 IP 1.1.2.3.41625 > 5.6.7.8.http: Flags [.], ack 1304, win 132, options [nop,nop,TS val 578946 ecr 578889], length 0
11:48:33.505380 IP 1.1.2.3.41626 > 5.6.7.8.http: Flags [S], seq 4236403379, win 5840, options [mss 1460,sackOK,TS val 579027 ecr 0,nop,wscale 6], length 0
11:48:33.505613 IP 5.6.7.8.http > 1.1.2.3.41626: Flags [S.], seq 2807736142, ack 4236403380, win 5792, options [mss 1460,sackOK,TS val 578969 ecr 579027,nop,wscale 6], length 0
11:48:33.505647 IP 1.1.2.3.41626 > 5.6.7.8.http: Flags [.], ack 1, win 92, options [nop,nop,TS val 579027 ecr 578969], length 0
11:48:33.505701 IP 1.1.2.3.41626 > 5.6.7.8.http: Flags [P.], seq 1:117, ack 1, win 92, options [nop,nop,TS val 579027 ecr 578969], length 116
11:48:33.505911 IP 5.6.7.8.http > 1.1.2.3.41626: Flags [.], ack 117, win 91, options [nop,nop,TS val 578970 ecr 579027], length 0
11:48:33.508857 IP 5.6.7.8.http > 1.1.2.3.41626: Flags [.], seq 1:1449, ack 117, win 91, options [nop,nop,TS val 578970 ecr 579027], length 1448
